Question,Answer,Answer key,Option A,Option B,Option C,Option D,Option E
"What is the purpose of the ""Protective stop button"" in the operator GUI?","The ""Protective stop button"" in the operator GUI is used to trigger a protective stop in case of emergencies.",,,,,,
"How does the ""Robot status panel"" in the operator GUI provide assistance to the operator?","The ""Robot status panel"" in the operator GUI shows an overview of the Robot status, indicating any warnings or errors through a color scheme with status indicator lights.",,,,,,
"When would an operator see the color indicator ""Red"" on the ""Robot status panel"" in the operator GUI?","The color indicator ""Red"" on the ""Robot status panel"" in the operator GUI signifies an error, indicating that the Robot is not operational and requires immediate attention.",,,,,,
"What does the indicator for ""Surrounding"" represent on the ""Robot status panel"" in the operator GUI?","The ""Surrounding"" indicator on the ""Robot status panel"" in the operator GUI shows if there is an obstacle or cliff in the Robot's path, changing to yellow and displaying ""Obstacle"" when an obstacle is detected.",,,,,,
"How does the ""Communication"" indicator on the ""Robot status panel"" in the operator GUI inform the operator?","The ""Communication"" indicator on the ""Robot status panel"" in the operator GUI turns yellow with a diagonal line through the icon to indicate that the Robot has lost its connection to the operator's computer.",,,,,,
"What does the ""Localization"" indicator on the ""Robot status panel"" in the operator GUI signify?","The ""Localization"" indicator on the ""Robot status panel"" in the operator GUI turns yellow if the Robot is not localized, prompting the operator to open the localization and mapping panel.",,,,,,
"How is the battery status of the Robot displayed on the ""Robot status panel"" in the operator GUI?","The battery status of the Robot is shown on the ""Robot status panel"" in the operator GUI with two thresholds: yellow indicating a low battery and red indicating a critically low battery.",,,,,,
"What functions are available in the ""Mission panel"" of the operator GUI?","The ""Mission panel"" in the operator GUI is used to select and run autonomous missions on the Robot.",,,,,,
"How does the ""Menu button"" in the operator GUI assist the operator?","The ""Menu button"" in the operator GUI opens a menu with applications for editing the Robot's work environment and tools for advanced monitoring and control.",,,,,,
"In what scenarios would an operator select the ""GUI cut power slider"" in the operator GUI?","The ""GUI cut power slider"" in the operator GUI is used to immediately stop the Robot, typically in situations requiring quick intervention or power cut-offs.",,,,,,
"What does a yellow differential pressure indicator on the Robot mean, and what action should be taken?","A yellow differential pressure indicator signifies a warning status, and it indicates the need to bring the Robot back to the safe zone.",,,,,,
"When the collision avoidance switch on the Robot is set to ""Blind,"" what behavior does the Robot exhibit?","Setting the collision avoidance switch to ""Blind"" means that the Robot operates without actively avoiding collisions.",,,,,,
"How can the user view warnings and errors related to the Robot's health status?","The user can monitor warnings and errors about the Robot's health status by checking the color of the button, where yellow signifies a warning status and red indicates an error status.",,,,,,
"What should be done if the Robot's processor or memory usage is too high?","If the Robot's processor or memory usage is excessively high, the user should refer to the ""9.9 Processor or memory usage too high"" section for guidance.",,,,,,
How can the user access and interact with the zoom camera in the inspection payload of the Robot?,The user can access and interact with the zoom camera in the inspection payload by selecting a point in the 3D Visualization panel to center the camera around the chosen point and draw a frame to center and zoom into the region of interest.,,,,,,
"What type of data is shown in the 3D Visualization panel of the Robot's sensor panel?",The 3D data displayed in the 3D Visualization panel includes information from the Lidar unit and depth cameras.,,,,,,
What is the recommendation provided by ANYbotics regarding the visualization of sensor data with the Robot connected to a wireless network?,ANYbotics recommends enabling the visualization of sensor data only when necessary to conserve network bandwidth and prevent potential delays in GUI and visualization rendering.,,,,,,
How can the user interact with the front wide angle camera on the Robot?,The user can open or close the video feed window from the front wide angle camera by controlling the Front wide angle camera option.,,,,,,
What sensors can be controlled by turning the front/rear upper and lower depth cameras on or off?,"The front/rear upper and lower depth cameras, along with the left/right depth cameras, can be controlled by turning them on or off.",,,,,,
What caution should be taken when visualizing multiple sensors simultaneously on the Robot?,"While visualizing multiple sensors concurrently, it is important to note that it may demand substantial bandwidth and could potentially slow down the GUI and visualization rendering.",,,,,,
How can you turn the image for the depth cameras on/off?,"To turn the image for the depth cameras on/off, you can use the $box$ tool on the sensor panel.",,,,,,
What does the elevation map on the GUI show?,The elevation map on the GUI displays a local 2.5D map containing the elevation of the Robot and the local terrain around it.,,,,,,
How can you control the spot brightness window?,You can open/close the spotlight brightness window using the $Spotlight$ tool on the sensor panel.,,,,,,
What does the Robot joypad tool do in walk mode?,"In walk mode, the Robot joypad tool translates commands into velocity commands for steering the Robot.",,,,,,
What happens when the GUI cut power is activated?,Activating the GUI cut power causes the Robot to collapse by cutting off power to the actuators.,,,,,,
How can you configure the content of the 3D visualization panel?,"To configure the content of the 3D visualization panel, you can use the $Select \ Displays$ option.",,,,,,
What is the purpose of the interaction marker in the 3D Visualization panel?,The interaction marker allows users to interact with the Robot and the operation environment by representing a simplified Robot with a coordinate system at its center.,,,,,,
How does the Robot joypad tool behave in stand mode?,"In stand mode, the Robot joypad tool translates commands into main body posture commands for controlling the Robot.",,,,,,
Where is the GUI cut power slider located?,The GUI cut power slider is located at the bottom center of the operator GUI.,,,,,,
What is the warning associated with engaging the GUI cut power?,Engaging the GUI cut power carries a risk of serious injury or death as it causes the Robot to collapse and cuts power to the actuators.,,,,,,
How can you interact with the Robot using the interaction marker in the manual?,"By left-clicking the blue ring of the interaction marker and dragging it around to pan or rotate, and right-clicking to open a menu of actions.",,,,,,
"What is the purpose of the ""Set localization initial guess"" action in the Robot manual?",To give the Robot an initial guess of its location within the map for self-localization based on sensor input and loaded map.,,,,,,
"When using the ""Plan Path to Here (Straight Line)"" action, what type of path is visualized in the 3D Visualization?",A straight line path from the current Robot position to the interaction marker.,,,,,,
"What precaution is highlighted in the manual regarding the ""Go Here (Straight Line)"" feature of the Robot?","It should not be used for climbing stairs or in areas where the Robot may fall, only on flat terrain under 3 meters.",,,,,,
"How does the Robot handle the ""Take Thermal Picture"" action when the thermal camera is installed?",It takes a picture of a point of interest using the thermal camera.,,,,,,
"What is the purpose of the ""Publish LIDAR point cloud data"" action in the Robot manual?","To provide a manual initial localization guess if automatic place recognition fails using the interaction marker's position.",,,,,,
What does the Navigation goal object icon represent on the 3D Visualization panel?,It defines a pose for the Robot to navigate to.,,,,,,
How can you send the Robot to a Navigation goal object location from the environment objects list?,"By right-clicking on the Navigation goal object and choosing ""Go Here"".",,,,,,
"What is the function of the ""Environment panel"" in the Data management panel of the Robot?",It is used to manage the ANYmal work environment data.,,,,,,
How can you access the history of Robot actions and events in the Data management panel?,"By using the ""Report panel"" to view the history of Robot actions and events.",,,,,,
What is the purpose of the Connection widget in the work environment described?,The Connection widget is used to input connection details for the Robot to establish communication with other devices or systems.,,,,,,
How does the Task widget contribute to the work environment described?,The Task widget shows the current task running on the Robot and provides information about its progress to the operator.,,,,,,
Describe the function of the Data Package tab in the Tabs widget.,"The Data Package tab is used to synchronize data packages between the Robot and the operator's computer to ensure data consistency.",,,,,,
"In the work environment, what is the role of the Logs tab within the Tabs widget?","The Logs tab is used to upload logs from the Robot to the server for analysis and download logs from the server to the operator's computer for review.",,,,,,
How can the Menu panel be utilized in the described work environment?,"The Menu panel contains applications for editing the Robot's work environment and advanced tools for monitoring and control, enhancing operational capabilities.",,,,,,
What is the specific purpose of the Waypoints Editor listed in the applications available for editing the work environment?,"The Waypoints Editor is used to create and edit predefined points for navigation and inspection within the Robot's work environment.",,,,,,
How does the Motion Control tool aid in the monitoring and control of the Robot?,"The Motion Control tool allows the operator to select specific motion states or transitions for precise control over the Robot's movements.",,,,,,
What functionality does the Mission panel serve in the work environment?,"The Mission panel is used to control autonomous missions, enabling the operator to start, pause, and monitor mission progress.",,,,,,
Explain the purpose of the Task progress panel in the described work environment.,"The Task progress panel provides an overview of the process options for a mission task, including step details and overall task status updates.",,,,,,
How are the Step status indicators useful for the operator in monitoring mission progress?,"The Step status indicators inform the operator about the current status or outcome of each step in a mission, indicating successful, unsuccessful, or paused steps for effective task management.",,,,,,
How is the task anomaly indicated in the task status indicators?,The task anomaly is indicated when the measured value is outside the normal operating range.,,,,,,
Can you provide an example of when a task is considered successful according to the task status indicators?,A task is considered successful when a measured value can be read and is within the normal operating range.,,,,,,
What does the protective stop function in the ANYbotics Workforce app do?,The protective stop function is used to activate a protective stop for the Robot.,,,,,,
How can you access additional options for every page in the ANYbotics Workforce app?,Additional options for every page can be accessed through the contextual menu.,,,,,,
How is the basic information and connectivity status of the ANYbotics Workforce app represented in the app interface?,The basic information and connectivity status are shown in the status bar of the app.,,,,,,
What does the Cut power slider function in the ANYbotics Workforce app do?,The Cut power slider function is used to cut the power from the drives of the Robot.,,,,,,
How can you change the collision avoidance settings using the ANYbotics Workforce app?,The collision avoidance settings can be changed through the Collision avoidance setting option in the app.,,,,,,
What information is displayed by the User interaction mode in the ANYbotics Workforce app?,The User interaction mode displays the current user interaction mode of controlling the Robot.,,,,,,
What does the Battery level and pressure level values represent on the app interface?,The Battery level and pressure level values indicate the current levels of battery and pressure.,,,,,,
How can you open the recording page from the operator task menu in the ANYbotics Workforce app?,The recording page can be opened by selecting the option in the operator task menu.,,,,,,
How can you change the user input from multi-touch to single-touch?,"To change the user input from multi-touch to single-touch, you can follow these steps:  
1. Select the option for single-touch input.  
2. Choose from camera movements like Rotation, Zoom, and Lateral movement.  
3. You can now control the camera movement with a single drag on the screen.",,,,,,
What are the available camera movements when using single-touch input?,"The available camera movements when using single-touch input are Rotation, Zoom, and Lateral movement.",,,,,,
How can you edit items from the 3D map display?,"To edit items from the 3D map display, you can proceed as follows:  
1. Select an item by pressing it on the screen or searching for the item name.  
2. Navigate to the Edit option on the overview page.  
3. On the edition page, you can change the type of the item, set the Robot's pose, and adjust the tolerance.  
4. Finally, select Update to finish editing.",,,,,,
What tasks can be performed using the Robot control menu?,"The Robot control menu contains tools to control the motion of the Robot and the inspection payload, as well as display the selected operational mode.",,,,,,
How does the data synchronization server facilitate data transfer to and from Robot computers?,"The data synchronization server is essential for transferring data to and from Robot computers. It can be accessed by an on-Robot agent or a client on the operator computer, enabling tasks like updating environment data packages, archiving mission reports, and accessing log files.",,,,,,
What are the types of data synchronization servers available?,"The types of data synchronization servers include Global infrastructure server, Local infrastructure server, and Local ad-hoc server.",,,,,,
How does the Global infrastructure server function as a service for Robot owners?,"The Global infrastructure server, operated by ANYbotics as a service, automatically synchronizes all onboard files when connected to by an on-board agent. Customers can avail of this optional service by contacting ANYbotics customer service.",,,,,,
What are the main functions of an on-Robot agent in data synchronization?,"On-Robot agents establish connections to data synchronization servers, secure the connection, and notify servers of any changes to files on the Robot using an efficient event-based system.",,,,,,
In what ways can a client installed on the operator computer interact with a data synchronization server?,"A client installed on the operator computer can connect to a data synchronization server, download automatically transferred files, and request file transfers from on-Robot agents.",,,,,,
What is the process for navigating to the Robot control menu using the ANYbotics Workforce app?,"To access the Robot control menu through the ANYbotics Workforce app, refer to ""8.3.5 How to change operational modes using the ANYbotics Workforce app"" on page 198 for detailed instructions.",,,,,,
What is the purpose of an ad-hoc server in the context of data synchronization?,"An ad-hoc server in data synchronization allows for temporary unauthenticated access, usually set up by the Robot owner on the Operator computer for facilitating quick data transfers.

---",,,,,,
How does the TLS Client Certificate system contribute to ensuring secure authentication in data synchronization?,"The TLS Client Certificate system uses pre-installed certificates to authenticate agents, ensuring secure connections with data synchronization servers through TLS/SSL encryption, preventing unauthorized access and man-in-the-middle attacks.

---",,,,,,
How can users of the operator GUI be authenticated when accessing data on the data synchronization server?,"Users of the operator GUI can be authenticated by entering a valid username and password, thus ensuring that only authorized users can access the data synchronization server.

---",,,,,,
What function does a VPN server serve in establishing communication between the Robot and an OPC in an external network?,"A VPN server reroutes all traffic between the Robot and the OPC through a secure connection, enabling communication between the two devices even when they are not in the same local network.

---",,,,,,
"In the context of Robot programming, how can the functionality of the Robot be extended?","The functionality of the Robot can be extended by directly programming the onboard software, allowing for customization and integration of new features as needed.

---",,,,,,
What advantages does using a simulation tool offer in testing and practicing Robot features?,"Using a simulation tool provides a quick and safe environment to test Robot features, simulate different scenarios, control the Robot via APIs, and experiment with configuration changes, all without affecting the physical Robot.

---",,,,,,
How closely does the simulation tool represent the real-world capabilities of the Robot?,"The simulation tool closely models most of the Robot's sensing and actuation capabilities, offering an accurate representation of its behavior while excluding low-level software like drivers and firmware.

---",,,,,,
Why is correct installation and commissioning essential for the ANYbotics systems and Robot?,"Correct installation and commissioning are crucial to prevent serious injuries, death, or damage, as errors in the setup can lead to life-threatening situations and significant property damage.

---",,,,,,
What precautions should be taken when unpacking the Robot from the Transport Box?,"When unpacking the Robot, it is crucial to ensure the presence of all items and to handle the Robot with care, preferably by utilizing the provided handles to avoid damage.

---",,,,,,
What item is typically found in the Transport Box along with the Robot when it is delivered?,"Along with the Robot, a Robot battery and a Robot battery charger with a charging cable are commonly found in the Transport Box during delivery.",,,,,,
What accessories come with the Transport Box?,"The accessories that come with the Transport Box are: One Robot battery charging adapter, one ethernet cable (M12-RJ45-Interface cable), and four handles used for lifting the Robot.",,,,,,
What additional items are included in the Transport Box if you acquired the corresponding accessories?,"If you acquired the corresponding accessories, the additional items included in the Transport Box are: One docking station, one spare Robot battery, one inspection payload (attached to the Robot), and one cellular module 4G/LTE.",,,,,,
How many handles are provided in the Transport Box for lifting the Robot?,There are four handles provided in the Transport Box for lifting the Robot.,,,,,,
What type of cable is included in the Transport Box for connecting to the network?,The Transport Box includes an ethernet cable (M12-RJ45-Interface cable) for connecting to the network.,,,,,,
What type of battery charging adapter is included in the Transport Box?,"The Transport Box includes a Robot battery charging adapter for charging the Robot's battery.",,,,,,
What is the purpose of the spare Robot battery included in the Transport Box?,The spare Robot battery included in the Transport Box serves as a backup power source for the Robot.,,,,,,
How is the inspection payload attached to the Robot in the Transport Box?,The inspection payload is attached to the Robot in the Transport Box using specific mounting mechanisms provided.,,,,,,
Can the cellular module 4G/LTE be used for remote communication with the Robot?,"Yes, the cellular module 4G/LTE included in the Transport Box can be used for remote communication with the Robot.",,,,,,
Is the docking station included in the Transport Box used for recharging the Robot?,"Yes, the docking station included in the Transport Box is used for recharging the Robot when not in use.",,,,,,
"How does the Robot's power cable in the Transport Box connect to a power source?","The Robot's power cable in the Transport Box connects to a power source using a standard power outlet or adapter.",,,,,,