Question,Answer,,,
How does pipe storage (linepack capacity) provide operational flexibility for hydrogen storage?,"Pipe storage provides high operational flexibility by allowing reformers to dispatch H$_2$ at times of peak demand, reducing oversizing of production capacity.",,,
What are the advantages of using salt caverns for large-scale hydrogen storage installations?,"Salt caverns are advantageous for large-scale hydrogen storage installations due to their impermeability to high pressure gases, prevention of biochemical reactions, high injection and withdrawal rates, and comparatively low construction costs.",,,
Why is the spatial and temporal variation of renewable energy generation considered in studies about hydrogen storage integration?,Spatial and temporal variation of renewable energy generation is considered to optimize the design of national energy systems and to ensure a continuous and reliable supply of hydrogen.,,,
What is the volumetric energy density of hydrogen compared to natural gas on a higher heating value basis?,"On a higher heating value basis, hydrogen has a volumetric energy density of 12.7 MJ m$^{-3}$ compared to 40.0 MJ m$^{-3}$ for natural gas at similar temperature and pressure.",,,
How do hydrogen pipelines compensate for their lower volumetric energy density compared to natural gas?,"Hydrogen pipelines compensate for their lower volumetric energy density by operating at higher flow rates, using larger diameters, pressure drops, and potentially parallel pipelines.",,,
How can mathematical modelling tools aid in the development of cost-effective pipeline network designs for decarbonization?,Mathematical modelling tools can help in developing new network configurations for large-scale decarbonization by considering economic and environmental factors and meeting the delivery requirements of hydrogen for various sectors.,,,
What is the proposed diameter for hydrogen pipelines in the H21 project in the UK for covering the majority of network routes in the North of England region?,"The proposed diameter for hydrogen pipelines in the H21 project in the UK is 1200 mm, covering over 75% of network routes in the North of England region.",,,
How do larger pipeline diameters and pressure drops contribute to compensating for the lower volumetric energy density of hydrogen?,"Larger pipeline diameters and pressure drops allow hydrogen pipelines to operate at higher flow rates, compensating for its lower volumetric energy density compared to natural gas.",,,
Why is the integration of hydrogen storage across different sectors important in the design of national energy systems?,The integration of hydrogen storage across different sectors is important in optimizing the design of national energy systems to ensure a reliable and sustainable supply of hydrogen.,,,
Why are salt caverns considered well-suited for large-scale hydrogen storage installations?,"Salt caverns are considered well-suited for large-scale hydrogen storage installations due to their impermeability, prevention of biochemical reactions, high injection and withdrawal rates, and relatively low construction costs compared to other storage options.",,,
What is the significance of linepack flexibility in a gas grid system?,Linepack flexibility allows for managing short-lived imbalances between demand and supply by varying the grid pressure within a minimum and maximum value.,,,
How does the utilization of salt caverns differ between short-term and medium/long-term gas storage?,Salt caverns are better suited for medium and long-term storage where changes in the cavern-wall pressure gradient are limited compared to short-term storage.,,,
Why is it economically advantageous to deploy larger pipe diameters for H$_2$ transmission networks?,"Increasing pipe diameters instead of building multiple pipelines in parallel offers economic value, as indicated by the deployment of 1050-1200 mm pipes across the network for H$_2$.",,,
What are the advantages of lower-pressure H$_2$ transmission networks over higher-pressure networks?,"Lower-pressure H$_2$ transmission networks of greater length can integrate distributed modes of production, whereas higher-pressure networks are more cost-effective for large centralized production of H$_2$.",,,
How does the safety distance for H$_2$ transmission relate to operating pressures and pipe sizes?,"The safety distance for H$_2$ transmission increases with higher operating pressures and pipe sizes, reflecting a minimal risk of impact.",,,
How does the risk of leakage in H$_2$ transmission networks compare to that of natural gas pipelines?,"The risk from leakage of H$_2$ in transmission networks is comparable to that of natural gas due to the rapid dispersal of H$_2$ upon release, even though H$_2$ is less dense.",,,
How can the overall safety of a transportation network for H$_2$ be ensured?,"The overall safety of an H$_2 transportation network can be ensured through robust mechanical design, appropriate material selection, specific hazard considerations, and compliance with relevant design codes.",,,
What is the European classification of H$_2$ as a flammable gas in terms of pipeline design?,H$_2$ is classified as a flammable gas within Category 'E' of the European Standard pipeline design code BS-EN-14161:2011.,,,
How do blend compositions above 20% of H$_2$ impact the safety considerations of pipelines?,Blend compositions above 20% of H$_2$ increase the severity of vented explosions while marginally reducing the fire hazard in pipelines.,,,
How are new functional specifications being developed for pipelines transporting polyethylene in terms of ensuring safe and sustainable operation?,New functional specifications are being developed to incorporate design standards on operating characteristics and monitoring to ensure the safe and sustainable operation of polyethylene pipelines.,,,
How do legal and regulatory requirements play a role in enabling the development of hydrogen infrastructures?,"Legal and regulatory requirements are crucial in providing a framework that balances climate ambitions, flexibility, security of supply, cost effectiveness, safety, and fairness for final customers, ultimately determining the feasibility and success of hydrogen infrastructure projects.",,,
What key guiding principles are recommended for enabling a higher share of hydrogen within the energy system according to the author?,"The key guiding principles recommended are integrated energy system planning, efficient permitting procedures for infrastructure projects, transparent access to the grid, and safe operation of transport networks.",,,
Why is integrated energy system planning important for the integration of hydrogen into the energy market?,Integrated energy system planning is necessary to facilitate the integration of hydrogen and other low GHG footprint gases by allowing for the coupling of different sectors and ensuring consistency between various policy objectives and planning levels.,,,
How does the Gas Directive 2009/73/EC pave the way for the integration of hydrogen into natural-gas networks?,"The Gas Directive 2009/73/EC allows for the injection of other types of gas into natural gas networks, thus providing a basis for integrating small volumes of hydrogen.",,,
In what way does the European Commission's 'Hydrogen and Gas markets Decarbonisation??package aim to revise the Gas Market Directive?,The package aims to comprehensively revise the Gas Market Directive and Regulation to facilitate the decarbonization of gas markets and enable the incorporation of a higher share of hydrogen within the energy system.,,,
"Why is it important for legal frameworks to consider the development stage of the sector, such as hydrogen infrastructure?","Legal frameworks need to account for the sector's stage of development to implement a progressive regulatory approach that is tailored to evolving market conditions, avoiding simply copying existing mature market models.",,,
How can transparent access to the grid contribute to the integration of hydrogen into the energy system?,"Transparent access to the grid facilitates the conversion and usage of gas grids for hydrogen, enabling a smoother transition towards incorporating hydrogen as an energy carrier.",,,
In what ways can efficient permitting procedures for infrastructure projects benefit the development of hydrogen infrastructures?,"Efficient permitting procedures can expedite the deployment of hydrogen infrastructures by streamlining regulatory processes and reducing bureaucratic hurdles, thus supporting the growth of hydrogen technologies.",,,
What role does safe operation of transport networks play in the successful deployment of hydrogen infrastructure?,"Ensuring the safe, effective, and smart operation of transport networks is essential for maintaining the reliability and integrity of hydrogen infrastructure, fostering public trust and confidence in this emerging energy carrier.",,,
"How do regulatory models need to adapt to cater to still emerging markets, compared to mature markets?","Regulatory models must adopt a progressive approach, incorporating dynamic regulations that are gradually implemented and tailored to the evolving needs of emerging markets, rather than simply replicating existing frameworks from mature markets.",,,
How does Regulation (EU) 2018/1999 on the Governance of the Energy Union promote integrated energy system planning at the EU level?,Regulation (EU) 2018/1999 promotes integrated energy system planning through instruments like the integrated national energy and climate plans (NECPs) and the long-term strategies (LTSs).,,,
What are the two main instruments defined by the Governance Regulation as part of the 'governance mechanism'?,The two main instruments defined are the integrated national energy and climate plans (NECPs) and the long-term strategies (LTSs).,,,
How does the Gas Directive 2009/73/EC enable the transport of hydrogen through existing gas grids?,"The Gas Directive allows for the transportation of hydrogen through existing gas grids as long as it meets compatibility, safety requirements, and the principle of non-discrimination.",,,
What potential for improvement is suggested in terms of energy system integration in the current Governance Regulation?,"An improvement could be incorporating a requirement to assess the potential for energy system integration systematically, including for different energy carriers such as H$_2$.",,,
What is the current legal uncertainty regarding the regulation of transportation through pipelines dedicated solely to hydrogen?,"There are no specific EU law provisions addressing a transportation system purely dedicated to hydrogen, leading to legal uncertainty and potential national approaches.",,,
How can existing infrastructure planning procedures be utilized to further integrate hydrogen into the energy system?,"National Development Plans (NDPs), Ten-Year Development Plans (TYDPs), and the Gas Target Model could incorporate hydrogen uses, sector coupling, and repurposing opportunities for gas assets.",,,
What regulatory challenges arise in the context of transporting hydrogen through pipelines not connected to the natural gas network?,"Transporting hydrogen through dedicated pipelines falls outside the scope of the Gas Directive, necessitating either a revision of the directive or the adoption of a specific legal act dedicated to hydrogen.",,,
How does the Governance Regulation focus on the integration of energy and climate plans within the EU?,The Governance Regulation primarily emphasizes the formal integration processes for energy and climate plans and identifies interlinkages with a target compliance perspective.,,,
Why is there a need for harmonization of regulation at the EU level regarding hydrogen transport networks?,"Harmonization is necessary to address legal uncertainties, ensure consistency in regulations, and facilitate the development of hydrogen transportation infrastructures within the internal market for energy.",,,
What opportunities do the NECPs and LTSs present for advancing integrated energy system planning?,The NECPs and LTSs offer opportunities to advance integrated energy system planning by providing a framework for the elaboration and assessment of energy and climate plans.,,,
How does the complexity of existing permitting procedures for H$_2$ projects impact their development?,The complexity of existing permitting procedures for H$_2$ projects increases administrative and financial burdens for project developers and poses a risk of delays due to the need to obtain multiple permits through the supply chain.,,,
What are some potential solutions mentioned in the article to streamline the permitting process for H$_2$ projects?,"Some potential solutions include conditional or unconditional permit exemptions, creating a single regulatory body (one-stop shop), and mandated coordination between existing regulatory agencies responsible for permitting processes.",,,
How can the permitting process for H$_2$ projects be simplified at both the national and EU levels?,"The permitting process for H$_2$ projects can be simplified through streamlined processes, coordination between agencies, concrete time limits for decisions, transparency, and the obligation to designate one-stop shops for authorization.",,,
What role do permitting processes play in increasing public support and acceptance of H$_2$ activities?,"Permitting processes can increase public support and acceptance of H$_2$ activities by including impact assessments, consultation processes, and compensation mechanisms for local populations, thereby ensuring project feasibility and avoiding local opposition.",,,
Why is grid access important for integrating hydrogen into the energy market?,"Grid access is important for integrating hydrogen into the energy market as it determines the viability, including commercial aspects, of new energy projects and provides assurance to energy generators regarding selling and transmitting their energy.",,,
What legislative measures have been introduced to reduce uncertainties around grid access conditions for hydrogen?,"Specific legislative measures introduced include priority or guaranteed access to the grid, which provide assurance to energy generators and ensure that all sold energy has access to the grid.",,,
How do priority access and guaranteed access to the grid differ in terms of ensuring energy transmission?,"Priority access to the grid assures connected energy generators of being able to sell and transmit energy when available, while guaranteed access ensures that all sold energy integrated into the market obtains grid access.",,,
How can priority access and guaranteed access to the grid support the integration of hydrogen into the energy market?,"Priority access and guaranteed access to the grid support the integration of hydrogen by providing assurance to energy generators, facilitating energy transmission, and reducing uncertainties in grid access conditions.",,,
What implications do uncertainties around grid access conditions have for the commercial viability of new energy projects like hydrogen?,"Uncertainties around grid access conditions impact the commercial viability of new energy projects, such as hydrogen, by creating barriers to integration into the energy market and potentially affecting the profitability of these projects.",,,
In what ways can regulatory measures ensure a more transparent and efficient process for grid access for hydrogen projects?,"Regulatory measures can ensure a more transparent and efficient process for grid access for hydrogen projects by implementing priority or guaranteed access, setting concrete time limits, and designating one-stop shops for authorization and licensing.",,,
How do the existing EU rules allow States to grant priority or guaranteed access to the grid for renewable energy sources and CHP applications?,The existing EU rules allow States to grant priority or guaranteed access to the grid for renewable energy sources and CHP applications if operations comply with the national electricity permitting scheme and the Electricity Directive.,,,
Why does the Energy Efficiency Directive state that priority access for CHP to the grid must not endanger renewable energy expansion?,The Energy Efficiency Directive states that priority access for CHP to the grid must not endanger renewable energy expansion to show support for primarily renewable energy sources.,,,
Why is a review of the grid access regime necessary to integrate larger volumes of low carbon hydrogen into the energy market?,A review of the grid access regime is necessary to integrate larger volumes of low carbon hydrogen into the energy market to align with the EU Hydrogen Strategy and national hydrogen strategies.,,,
What is third party access (TPA) in the context of energy network facilities?,Third party access (TPA) is the legally enforceable right of economically independent undertakings to access and use various energy network facilities owned by other companies under specific terms.,,,
Why might a strict TPA regime be considered disproportionate in the current state of development of hydrogen markets?,A strict TPA regime might be considered disproportionate in the current state of development of hydrogen markets as it could hinder the development of hydrogen infrastructures.,,,
How does the Hydrogen and decarbonised gas market package propose to improve the TPA regime for hydrogen networks?,"The Hydrogen and decarbonised gas market package proposes a negotiated access until 2030, followed by a regulated access after 2030 to improve the TPA regime for hydrogen networks.",,,
"Why is grid conversion essential in integrating hydrogen into the energy market, according to the article?","Grid conversion is essential in integrating hydrogen into the energy market to achieve cost savings, local acceptance, environmental protection, and avoid the duplication of transport infrastructures.",,,
What benefits do gas grid operators investing in grid conversion expect to gain according to EU regulations?,Gas grid operators investing in grid conversion expect to recover their costs through tariffs and consider cross-subsidization of H2 networks by natural gas network revenues under certain conditions.,,,
How does the existing unbundling regime impact the deployment of hydrogen projects and integration into the internal energy market?,The existing unbundling regime may impact the deployment of hydrogen projects and integration into the internal energy market due to a lack of legal clarity regarding grid operators' unbundling requirements for activities like hydrogen storage.,,,
What key aspect is crucial in defining the legal qualification of hydrogen storage activities for successful project deployment and integration into the energy market?,"The legal qualification of hydrogen storage activities, including the applicability of the unbundling regime, is crucial for the successful deployment of hydrogen projects and integration into the energy market.",,,
How can government intervention help overcome investment barriers in the deployment of large-scale hydrogen infrastructure in Europe?,"Government intervention can provide a coherent strategic rationale for investment propositions along the value chain, support collaborative business models with the private sector, and facilitate the implementation of new regulations, markets, and infrastructure.",,,
What are the key outcomes that business models for first-of-a-kind investments should aim to achieve?,"Business models for such investments should ensure initial revenue from stable anchor users, commitment from government and private stakeholders, and flexibility for future market evolution.",,,
How can metrics for assessing projects and investments be broadened to include greater societal value beyond standard cost-benefit analysis?,"Metrics can be expanded to consider the overall value for society created by the investments, in addition to cost-benefit analysis and technology cost reduction.",,,
Why is it important for the initial market development for hydrogen end-use to be led primarily by government and/or public bodies?,Government-led market development ensures a smooth transition towards hydrogen end-use and allows for expertise and assistance from the private sector where needed.,,,
What are the essential components of risk sharing in structuring collaborative business models for hydrogen infrastructure investment?,"Risk sharing involves assets and rights ownership, capital sourcing, market development, and physical delivery to ensure optimal risk management between public and private sectors.",,,
How can systems thinking be applied to business models for large-scale hydrogen infrastructure?,Systems thinking can differentiate between system (macroeconomic) business models and business segment (microeconomic) business models to optimize outcomes across multiple economic sectors.,,,
Why is it crucial to select first-of-a-kind projects for government support based on an integrated system view?,"An integrated system view ensures collaboration and competition between stakeholders, projects, and regions to maintain cost-effectiveness and avoid new barriers for expansion over time.",,,
How can business models for large-scale hydrogen infrastructure address the need for future evolution of markets and technology?,"Business models can provide flexibility and optionality for future market changes, technological advancements, and utilization to adapt to evolving needs and opportunities.",,,
What role should government play in supporting the deployment of first-of-a-kind hydrogen infrastructure projects?,"Government should play a leading role in providing initial market development, investment incentives, and risk mitigation strategies to drive the successful deployment of such projects.",,,
How can collaborative business models between public and private sectors contribute to the successful investment in hydrogen infrastructure?,"Collaborative business models can optimize risk allocation, resource sourcing, and market development efforts to ensure the alignment of interests between public and private stakeholders, fostering successful investment in hydrogen infrastructure.",,,
How do endogenous risks differ from exogenous risks in the context of infrastructure investment in the hydrogen/CCS chain?,"Endogenous risks are related to the specific business segment within the chain and can be mitigated by operational business models, while exogenous risks, such as political, policy, and social risks, require a macroeconomic solution involving both public and private sector investments.",,,
Why is infrastructure investment in the hydrogen industry considered distinctive compared to other energy sectors?,"Infrastructure investment in the hydrogen industry is distinct due to characteristics like the need for major upfront capital, long term revenue streams, public involvement, complex value delivery, and the requirement to address natural monopolies.",,,
What are the key components that an integrated system business model for hydrogen infrastructure should address?,"The system business model for hydrogen infrastructure should address elements like system-level strategic rationale, cross-sectoral synergies, low-carbon end-use markets, enduring system governance, public-private risk sharing, and societal acceptance.",,,
Why is the valuation of societal benefits crucial in assessing the transition to a hydrogen-based energy system?,"Valuing societal benefits in addition to costs allows for a more comprehensive evaluation of investments in hydrogen technologies, considering factors like health impacts, economic multiplier effects, flexibility for future technology deployment, and the transition away from fossil fuels.",,,
What practical aspects should be considered in implementing the European Green Deal's 'just transition' mechanism through public-private collaboration?,"Practical aspects include evaluating the cost of pollution, economic multiplier effects, flexibility in technology deployment, synergies between energy sectors, and managing the transition away from fossil fuels while creating new opportunities for technology development.",,,
How can governments create a flexible decarbonization pathway in the hydrogen sector according to the document?,"Governments can create a flexible decarbonization pathway by focusing on first-of-a-kind investments principles like 'anchor' users, low-regrets, and optionality to adapt to technology advancements and cost improvements over time.",,,
What are some barriers to investment that both the public and private sectors face in the hydrogen industry with or without CCS infrastructure?,"Some barriers include political, policy, and social risks, the need for major upfront capital, long term revenue streams, public involvement, and the requirement to address natural monopolies.",,,
How does integrated energy system planning contribute to the development of policy and legal frameworks for hydrogen infrastructure?,Integrated energy system planning provides a generic structure to develop policy and legal frameworks for hydrogen infrastructure by enabling the practical removal of barriers to financing and physical delivery of objectives and outcomes.,,,
Why does low/zero-carbon hydrogen require substantial changes in end-use consumer markets and infrastructure compared to renewable electricity?,"Low/zero-carbon hydrogen requires changes in end-use consumer markets and infrastructure because it involves not just entering existing networks but also creating new infrastructure, including potential CO$_2$ transport and storage.",,,
