Question,Answer
What are the main components of the EU Hydrogen Energy Strategy to increase the share of hydrogen in the energy mix by 2050?,"The EU Hydrogen Energy Strategy includes investment plans across the industrial chain of hydrogen production, storage, transport, R&D, technological innovation, and international cooperation in hydrogen energy to increase the share of hydrogen in the energy mix."
How does France plan to reduce CO_$2$ emissions through its National Hydrogen Energy Strategy?,"France plans to reduce CO_$2$ emissions by building and installing hydroelectric devices on a large scale, developing the electrolysis industry, and promoting the use of hydrogen fuel cells in transportation."
What was the partnership announced by Hyundai Motor in Korea related to hydrogen fuel cell packages for alternative power solutions?,"In July 2021, Hyundai Motor announced a partnership with Hyundai Electric Energy Systems to develop hydrogen fuel cell packages for mobile generators and alternative marine power supply solutions."
"How does the Earth Initiative aim to reduce the cost of green hydrogen, and what funding did the US Department of Energy announce for hydrogen-related projects?",The Earth Initiative aims to reduce the cost of green hydrogen from $5 to $1 per kilogram within 10 years. The US Department of Energy announced $52.5 million in funding for 31 hydrogen-related projects.
What steps has Korea taken to support hydrogen energy in recent years?,"Korea has enacted the world's first Hydrogen Economy and Hydrogen Safety Management Act, laying the legal foundation for hydrogen energy commitment, implementing safety standards, and providing transparency in the hydrogen pricing system."
How is Japan focusing on hydrogen energy according to its formulated policies?,"Japan is focusing on hydrogen energy applications, transportation, production, and measures to achieve its hydrogen energy goals."
"What measures did Singapore take to support research and development in low-carbon energy, including hydrogen energy?",Singapore announced a $36 million low-carbon energy research grant program in 2020 to support the development of hydrogen energy and other low-carbon technologies.
What are Chile's aspirations regarding green hydrogen production and export?,Chile seeks to produce the world's cheapest green hydrogen by 2030 and become one of the top three hydrogen exporters globally by 2040.
How is the Egyptian government planning to empower hydrogen production and integration into the energy system?,"The Egyptian government issued a statement urging the development of a comprehensive national hydrogen strategy to enhance hydrogen production, utilization capabilities, and integrate green hydrogen into the integrated energy system."
"According to the International Energy Agency, what is expected by 2030 concerning the competitiveness of green hydrogen from renewable sources?","By 2030, green hydrogen from renewable sources is expected to become more cost-effective due to decreasing costs of solar and wind energy and emerging economies of scale from electrolytic tanks, leading to increased market recognition."
What are some challenges faced by the hydrogen industry in its current state of development?,"Challenges include infrastructure scale limitations, high costs of low-carbon hydrogen, immature application industry clusters, and imperfect policies and regulations."
"How many hydrogen refueling stations are operational in Europe, and what are the targets for Germany and France?","Europe has 200 hydrogen refueling stations operational. Germany plans to build 400 by 2023, and France aims for 400 to 1,000 stations by 2028."
How are Germany and Saudi Arabia planning to collaborate in the production and application of green hydrogen?,"Germany and Saudi Arabia will cooperate closely in green hydrogen's production, processing, application, and transportation."
"What was the purpose of the Canada-Taiwan Low Carbon Emissions - Hydrogen and Fuel Cells (HFC) Forum held on January 18, 2022?",The purpose of the forum was to bring together Canadian and Taiwanese leaders in the hydrogen fuel cell industry to discuss bilateral cooperation to achieve the goal of net zero carbon emissions by 2050.
What did Taiwan and Canada aim to establish through the memorandum of understanding signed at the forum?,"They aimed to establish an exchange and cooperation platform between industry, government, academia, and research to promote cooperation and development in the hydrogen energy and fuel cell technology field between Taiwan and Canada."
"How much does Taiwan expect to invest in low-carbon and carbon-negative technologies through 2030 according to the ""National Net Zero Technology Action Plan""?",Taiwan expects to invest approximately $41.5 billion through 2030 in low-carbon and carbon-negative technologies.
What are some of the main actions planned by the European Clean Hydrogen Alliance for establishing a complete hydrogen value chain in Europe?,"The Alliance plans to establish at least 40GW of renewable hydroelectric plants by 2030, with hydrogen production from renewable electricity and low-carbon hydrogen from fossil fuels to create a complete hydrogen value chain in Europe."
By what year does the UK aim to power 3 million homes with 5GW of hydrogen production capacity according to the National Hydrogen Strategy?,The UK aims to power 3 million homes by 2030 with 5GW of hydrogen production capacity.
"What are the main strategic investment areas for Korea in the hydrogen energy industry as outlined in the ""Roadmap for the Development of the Hydrogen Energy Economy""?","The main strategic areas include hydrogen fuel cell vehicles, fuel cells, refueling stations, power generation, gas production, storage, transportation, and safety regulation."
"What are Japan's two main goals outlined in the ""Basic Strategy for Hydrogen Energy"" and ""Hydrogen Energy Utilization Progress Chart""?",Japan aims to reduce the price of hydrogen fuel cell vehicles to the same level as hybrid vehicles by 2025 and build 900 hydrogen refueling stations by 2030.
How much does the US Department of Energy plan to spend on establishing regional hydrogen energy centers and reducing the cost of producing hydrogen from renewable sources?,The Department plans to spend $8 billion on regional centers and another $1 billion on reducing hydrogen production costs from renewables.
What percentage of US end-use energy demand is expected to be met by hydrogen by 2050 according to the Fuel Cell and Hydrogen Energy Association roadmap?,"By 2050, hydrogen is expected to meet 14% of US end-use energy demand."
"What is the primary focus of investment in hydrogen technology globally, as mentioned in the discussion?","The focus is on promoting hydrogen development and stimulating private investment, with the European public sector leading in hydrogen technology investment."
What are the common types of direct financing for renewable energy projects?,"Common types of direct financing for renewable energy projects include Private Placement, Public offerings of stock, Asset securitization, Yield Companies (Yield Co.), and Crowd fundraising."
"Can you explain the concept of ""Green Bonds"" and how they differ from ordinary bonds?","""Green Bonds"" are bonds specifically used to finance low-carbon environmental or green economy investments, where the funds raised must be used for ""green"" investment projects with positive environmental benefits. This differentiates them from ordinary bonds."
What are the 10 uses into which the funds raised from Green Bonds can be divided according to the Green Bond Principles?,"The 10 uses for funds raised from Green Bonds according to the Green Bond Principles are: 
i. Renewable Energy 
ii. Energy Upgrading 
iii. Pollution Prevention and Control 
iv. Environmental Sustainability Management of Biological and Land Resources 
v. Land and Water Biodiversity Conservation 
vi. Clean Transportation 
vii. Sustainable Water Resources and Wastewater Management 
viii. Climate Change Adaptation 
ix. Eco-efficient and circular economy products, production technologies and processes 
x. Green Buildings."
"When did Taiwan's green bonds issuance begin, and which banks were involved in the initial batch of issuances?","Taiwan's green bonds issuance began on April 21, 2017, with the involvement of KGI Bank, SinoPac Bank, Chinatrust Bank, and Yushan Bank in the initial batch of issuances."
"Who issued the first green corporate bond in Taiwan, and what projects were selected for funding?","CPC issued the first green corporate bond in Taiwan. CPC selected two projects for funding: the ""Taichung Plant Phase II Investment Plan of the Natural Gas Division"" and the ""Third Liquefied Natural Gas Receiving Station Investment Plan."""
What were the total issuance amounts for the first batch of Taiwan's green bonds issued by the four banks?,"The total issuance amount for the first batch of Taiwan's green bonds issued by KGI Bank, SinoPac Bank, Chinatrust Bank, and Yushan Bank was NT$5.17 billion."
"What is the scope of sustainable development bonds according to the ""Sustainable Development Bond Practice Guidelines"" in Taiwan?","The scope of sustainable development bonds in Taiwan includes green bonds, social responsibility bonds, and sustainable development bonds approved by the OTC."
"What is the total amount of green bonds issued by Taiwan Power as of May 9, 2022, and the expected total issuance by mid-June?","As of May 9, 2022, Taiwan Power has issued a total of $43.85 billion in green bonds. The total amount of green bonds expected to be issued by mid-June is $47.05 billion."
How does the US bipartisan infrastructure bill passed in November 2021 support hydrogen energy initiatives?,"The US bipartisan infrastructure bill allocated $8 billion for the Department of Energy to establish regional hydrogen energy centers, another $1 billion to reduce the cost of producing hydrogen from renewable sources, and $500 million to support hydrogen equipment production and build the US domestic supply chain."
What are the main sources of investment funding for the hydrogen industry and technology development globally?,The main sources of investment funding for the hydrogen industry and technology development globally include government funding and joint public and private investments.
What is the proposed amount for the Low and Zero Emission Fuel Fund mentioned in the context?,The proposed amount for the Low and Zero Emission Fuel Fund is $1.5 billion.
What is the total investment announced for the liquid hydrogen manufacturing plant expected to be operational by 2024?,The total investment announced for the liquid hydrogen manufacturing plant is $1.3 billion.
What is the objective of the UK Government's Net Zero Hydrogen Fund (NZHF) in terms of hydrogen energy production by 2030?,The objective of the UK Government's Net Zero Hydrogen Fund (NZHF) is to support the commercial deployment of new low carbon hydrogen projects with a target of 5GW of hydrogen energy production by 2030.
"How much funding has the German Federal Ministry of Education and Research provided for the ""Carbon2Chem"" project?","The German Federal Ministry of Education and Research has provided more than 60 million euros in funding for the ""Carbon2Chem"" project."
What was the main focus of the SNAMTEC program launched by SNAM S.p.A. in Italy?,"The main focus of the SNAMTEC program was to improve energy efficiency, reduce pollutant gas emissions, and foster technological innovation in the energy sector."
Which automotive companies are involved in the EU-funded research projects aimed at increasing the number of hydrogen fueling stations by 2022?,"Automotive companies involved in the EU-funded research projects include Audi, BMW, Hyundai, and Renault."
What is the projected percentage of CO$_2$ emissions reduction by introducing a 5% hydrogen quota into the energy mix according to the SNAMTEC project in Italy?,The SNAMTEC project projected a significant reduction in CO$_2$ emissions by introducing a 5% hydrogen quota into the energy mix in Italy.
How many public and private institutions signed a memorandum of cooperation for the development and use of hydrogen energy in the Czech Republic in 2019?,17 public and private institutions signed a memorandum of cooperation for the development and use of hydrogen energy in the Czech Republic in 2019.
What is the total budget for the two EU-funded research projects (H2ME1 and H2ME2) aiming to increase the number of hydrogen fueling stations by 2022?,The total budget for the two EU-funded research projects is ??70 million (??0 million for H2ME1 and ??00 million for H2ME2).
How many countries are represented by the partners involved in the EU-funded research projects for hydrogen technology for the automotive industry?,Partners from nine countries are involved in the EU-funded research projects aiming to advance hydrogen technology for the automotive industry.
How does the partnership between Air Liquide and TotalEnergies aim to decarbonize hydrogen production at the TotalEnergies' Normandy platform?,The partnership aims to supply TotalEnergies with low-carbon hydrogen by leveraging Air Liquide's hydrogen network in Normandy and implementing a large-scale CO$_2$ capture and storage solution.
"What technologies are being progressively supported to help develop a low-carbon hydrogen ecosystem in the ""Axe Seine/Normandy"" region?",Technologies such as carbon capture and storage (CCS) and electrolysis are being supported to develop the low-carbon hydrogen ecosystem.
How does Air Liquide plan to optimize the performance of the hydrogen production unit at the TotalEnergies platform in Normandy?,"Air Liquide will take over and operate the hydrogen production unit, connecting it to Air Liquide's hydrogen network to optimize performance and develop the world's first low-carbon hydrogen network."
What is the potential reduction in carbon emissions expected by 2030 from the unit's hydrogen production at the Normandy platform?,"The implementation of carbon capture and storage (CCS) projects is expected to reduce carbon emissions by approximately 650,000 tons of CO$_2$ per year by 2030."
How could hydrogen contribute to reducing emissions in the aviation sector by 2050?,"Hydrogen could help cut aviation emissions by 50% by 2050, offering a cleaner alternative for aircraft and airports."
How is low-carbon hydrogen produced in gaseous form for aviation applications?,"Low-carbon hydrogen is produced in gaseous form, often by using renewable energies for water electrolysis, such as at Air Liquide's Bécancour site in Quebec."
What role does Air Liquide play in decarbonizing the aviation industry with hydrogen?,"Air Liquide utilizes its expertise in the hydrogen value chain to help decarbonize aviation from ground logistics to in-flight services, contributing to a cleaner aviation industry."
In what ways can liquefied hydrogen be utilized within airport ecosystems?,"Liquefied hydrogen can be used for ground logistics at airports, powering vehicles like baggage tractors, forklifts, shuttles, and super tugs, as well as providing efficient refueling stations."
How does hydrogen contribute to reducing the environmental impact of vehicles within the airport ecosystem?,Hydrogen usage significantly reduces the environmental impact of vehicles like baggage tractors and shuttle buses by providing a cleaner alternative for ground logistics.
What potential applications of hydrogen can be found aboard aircraft for passenger comfort and operational efficiency?,"Hydrogen can be used aboard aircraft to power various systems in the cockpit, lighting, heating, catering, refrigeration, and potentially propulsion systems in the future."
What strategic partnership has Air Liquide announced in June 2021 to prepare for the arrival of the first hydrogen-powered commercial aircraft by 2035?,Air Liquide partnered with Airbus and the ADP Group to prepare Paris airports for the hydrogen era.
"How does the partnership between Air Liquide, Airbus, and Groupe ADP aim to contribute to the decarbonization of the aviation sector?",The partnership aims to support the decarbonization of the aviation industry through the development of hydrogen-powered commercial aircraft.
What milestone was achieved in 2021 at Incheon Airport T2 with the completion of the hydrogen refueling station?,The completion of the Incheon Airport T2 Hydrogen Refueling Station marked the commissioning of the 100th hydrogen refueling station across 68 sites in Korea.
What is the daily capacity of the hydrogen refueling station at Incheon Airport T2 supplied by Air Liquide?,"The station has a capacity of delivering 1 tonne of hydrogen per day, serving an average of 40 buses or 180 passenger cars daily."
How many times larger is the Incheon Airport T2 Hydrogen Refueling Station's capacity compared to the existing hydrogen stations in Korea?,The station is at least 4 times larger than the existing hydrogen stations in Korea.
In what ways does Air Liquide's technology at the Incheon Airport T2 Hydrogen Refueling Station facilitate efficient peak time management for refueling hydrogen-powered vehicles?,The technology allows two buses to fill simultaneously as well as passenger cars consecutively with limited waiting time.
"What is the main focus of the collaboration between Air Liquide, Airbus, Korean Air, and Incheon International Airport Corporation in Korea regarding hydrogen usage?",The collaboration aims to study the development of Korean airport infrastructure to support the deployment of hydrogen-powered commercial aircraft.
"How many employees approximately does Air Liquide have, and in how many countries is the company present?","Air Liquide has approximately 66,400 employees and is present in 75 countries worldwide."
"How long has Air Liquide been rooted in Taiwan, and how many production facilities and service locations does it have on the island?",Air Liquide has been rooted in Taiwan since 1987 with more than 40 production facilities and service locations.
"How does the strategic partnership between Air Liquide, Airbus, and the ADP Group aim to prepare for the first hydrogen-powered commercial aircraft's arrival in 2035?","The partnership focuses on carrying out feasibility studies to develop the necessary infrastructure, particularly for the specificity of liquid hydrogen supply at airports."
"How does the partnership between Air Liquide, Airbus, Korean Air, and Incheon International Airport Corporation aim to support the decarbonization of the aviation industry?","The partnership aims to define and develop the necessary liquid infrastructure at Incheon Airport for hydrogen-powered aircraft and leverage expertise in hydrogen value chain, ground operations, aviation management, and airport development."
What are some of the expertise and contributions that each partner brings to the deployment of hydrogen ecosystems at Korean airports?,"Air Liquide brings expertise in the hydrogen value chain, Airbus provides insights into hydrogen-powered aircraft operations, Korean Air contributes knowledge in ground aircraft operations, and Incheon International Airport Corporation offers airport development plans."
How does Bosch demonstrate its commitment to sustainability and ecological responsibility within its business operations?,"Bosch has achieved carbon neutrality at its worldwide locations, implemented strategies to reduce carbon emissions across its value chain, and focuses on technological responses to societal and ecological challenges."
What strategic approaches has Bosch implemented to reduce carbon emissions and achieve carbon neutrality?,"Bosch has leveraged energy efficiency, expanded renewable energy supply, procured green electricity, and offset unavoidable carbon emissions. They prioritize energy efficiency and renewable energy for long-term quality of carbon neutrality."
How does Bosch plan to reduce emissions along its value chains by 2030?,"Bosch aims to reduce emissions by 15% by 2030 through strategies like energy-efficient LED lighting, renewable energy sources, and systematic carbon emission reduction measures."
What distinguishes Bosch as a pioneer in climate action?,"Bosch has become carbon neutral at all its locations worldwide, making it the first globally operating industrial enterprise to achieve this. They prioritize technological responses to societal and ecological challenges."
How is Bosch's sustainability vision reflected in its product portfolio and strategic initiatives?,"Bosch shapes its product portfolio towards sustainability by contributing to the hydrogen economy, driving mobility transformation, and increasing industrial technology efficiency in alignment with its sustainability vision."
What role does Bosch's commitment to sustainability play in its business success?,"Bosch views sustainable, ecological, and socially responsible actions as integral to its business success, driving the development and application of technologies to address societal and ecological challenges."
"In what way does Bosch's approach to sustainability align with its overarching slogan of ""Invented for life""?","Bosch's commitment to sustainability embodies its slogan by focusing on innovative technological solutions that contribute to societal and ecological challenges, furthering the notion of being ""Invented for life."""
How does Bosch's partnership with other entities reinforce its position as a beacon of sustainability?,"Through collaborations and partnerships, Bosch leverages expertise and resources to drive sustainability initiatives, such as reducing carbon emissions, shaping the hydrogen economy, and promoting climate action in the industry."
