Question,Answer,,,
What are some key metrics that need to be broadened to assess the transition to net zero emissions with hydrogen as an energy carrier?,"Key metrics that need to be broadened include evaluating the societal benefits beyond just costs, considering economic multiplier effects, assessing the flexibility and optionality for future technology deployments, managing the decline of the fossil fuel industry, and creating new opportunities for an alternative energy system.",,,
What are some examples of business models that can facilitate large-scale implementation of hydrogen infrastructure?,"Business models that support new and evolving markets, deliver economies of scale, and are flexible to accommodate different production technologies such as electrolysis or methane reforming.",,,
How can sustained 'anchor' demand contribute to justifying investments in hydrogen infrastructure?,"Sustained 'anchor' demand, such as low carbon industrial clusters or transport hubs, can provide the initial justification for investments with minimum regrets and maximum optionality.",,,
What key factors should be considered in selecting the strategic early infrastructure users for hydrogen infrastructure projects?,"Key factors include minimizing implementation complexity (e.g., regulatory changes, technical risks), selecting markets where investment costs can be socialized (e.g., domestic heating), and ensuring support from local communities, society, and private investors.",,,
How can market development strategies ensure low-regrets investments and optionality in a country's decarbonization pathway?,"Market development strategies should focus on developing various hydrogen markets while minimizing risks of stranded assets, ensuring a balance between government support and market-based revenue, and actively promoting the demand for low carbon products and services based on hydrogen.",,,
What is the role of collaboration versus competition in the successful implementation of hydrogen infrastructure projects?,"Collaboration among stakeholders, including private sector companies, research institutions, and governments, is essential for innovation, feasibility, and project definition in hydrogen infrastructure. Finding a balance between collaboration and competition is crucial for the viability and expansion of infrastructure projects over time.",,,
How can inter-regional leadership and governance contribute to the development of a complete energy system decarbonization framework?,"Inter-regional leadership and governance can ensure cooperation, cross-sectoral integration, and the involvement of multiple regional organizations in developing low-regrets solutions for industrial decarbonization and hydrogen utilization.",,,
What are some challenges faced by industrial companies in Europe when considering a transition to low carbon 'green' products like hydrogen?,"Industrial companies in Europe face challenges in justifying additional investment costs and risks for fuel switching to hydrogen or carbon capture without sufficient demand or government support, even with available infrastructure.",,,
How can government support mechanisms be selected to promote the adoption of low-carbon products without penalizing intermediate or final use?,"Government support mechanisms should be chosen to avoid penalizing low-carbon products, socializing investment costs, and ensuring that infrastructure projects can transition from government-supported to market-driven expansion.",,,
What are the implications of establishing 'right' strategic early infrastructure users for the success of hydrogen projects?,"Selecting the 'right' strategic early infrastructure users can help in creating viable business models, garnering support from stakeholders, and ensuring the success of hydrogen projects in terms of scaling and sustainability.",,,
How can the minimization of risks of stranded assets contribute to the long-term viability of hydrogen infrastructure projects?,"By effectively managing volume and demand uncertainties, and ensuring flexibility in infrastructure design, the risks of stranded assets can be minimized, leading to more sustainable and successful hydrogen infrastructure projects.",,,
"How does risk allocation in infrastructure projects impact the attractiveness for equity, debt, and government investors?","Risk allocation in infrastructure projects can affect the acceptable rate of return, financeability, and value-for-money, influencing the attractiveness for equity, debt, and government investors. It also plays a role in ensuring the project remains viable through long-term contracts.",,,
In what ways can risks in infrastructure projects be mitigated by a combination of measures from both public and private sectors?,"Risks in infrastructure projects can be mitigated by measures such as bundling business activities, addressing policy and regulatory gaps, and facilitating cross-ownership of different segments of the value chain between the public and private sectors.",,,
How can bundling of business activities help remove investment barriers and reduce commercial risks in infrastructure projects?,"Bundling of business activities, like combining hydrogen retailing with distribution or combining transport and storage in one regulated business, can remove commercial and engineering risks, making the project more attractive for investors.",,,
What are the implications of the business model structures in determining the degree of transfer of responsibility and risks from the public sector to the private sector in infrastructure projects?,"The business model structures play a crucial role in determining how responsibility and risks are distributed between the public and private sectors in infrastructure projects, impacting ownership, financing, market development, revenue structure, and physical delivery.",,,
"How do different ownership structures, ranging from full public sector responsibility to full private sector involvement, impact the efficiency and competition levels in infrastructure projects?","Different ownership structures in infrastructure projects can vary from complete public sector responsibility to full private sector involvement, affecting efficiency, competition levels, and innovation potential within the project.",,,
Why might regulations need to be revisited to accommodate the deployment of hydrogen infrastructure in a cost-effective and optimal manner?,"Regulations may need to be reconsidered to support the deployment of hydrogen infrastructure efficiently, especially if existing regulations hinder the creation of necessary business models and market conditions for hydrogen infrastructure development.",,,
How can synergies and collaboration between the public and private sectors in infrastructure investment projects help address challenges associated with long-term capital requirements and monopolistic nature?,"Synergies and collaboration between the public and private sectors in infrastructure projects are essential for addressing challenges related to long-term capital requirements, value beyond traditional financial returns, and the monopolistic nature of certain infrastructure assets.",,,
What are some examples of successful cross-ownership structures in the international LNG industry and how have they facilitated investment and operability?,"Cross-ownership structures in the international LNG industry have been effective in facilitating investment and operability by allowing different segments of the value chain to be owned by various stakeholders, creating synergies and mitigating risks.",,,
How does the combination of hydrogen retailing with distribution help manage physical delivery challenges and enhance the efficiency of infrastructure projects?,"Combining hydrogen retailing with distribution can facilitate the efficient management of physical delivery challenges by aligning customer appliance conversion with supply network operation, thereby enhancing the overall efficiency of the infrastructure project.",,,
"Why is it important for business model structures in infrastructure projects to be adaptable to external investment environments, jurisdictions, and macro-economic conditions?","Adaptability of business model structures is crucial in infrastructure projects to ensure they can evolve and respond effectively to changing external investment environments, regulatory frameworks, jurisdictional requirements, and macro-economic conditions for long-term sustainability and success.",,,
What are some of the challenges faced by both the private and public sectors in critical infrastructure investment?,Some challenges faced by both sectors include market failures like market power for the private sector and inefficiencies and financing constraints for the public sector.,,,
How do public-private partnerships (PPPs) aim to address the challenges in infrastructure investment?,"PPPs aim to transfer risks to private investors, access capital funds, achieve better operating efficiencies, and retain government control over pricing and infrastructure development.",,,
What is the significance of collaboration between public and private sectors in the hydrogen value chain?,"Collaboration is important to overcome investment barriers, manage business risks, and address the uncertainty in future demand prospects.",,,
How does the UK H21 North of England regional hydrogen conversion roadmap propose to utilize hydrogen-CCS infrastructure?,"The roadmap proposes to deliver a hydrogen-CCS infrastructure network for domestic and commercial heating, industrial fuel switching, and power generation in northern regions of England by 2034.",,,
Why is private ownership envisaged for most sectors in the H21 business model?,"Private ownership is envisaged to leverage established ownership models and promote competition, except for CO $$_2$$ transport and storage infrastructure which may involve joint public-private ownership.",,,
How does the UK government plan to support the development of hydrogen infrastructure and markets according to the UK Hydrogen Strategy?,The government plans to undertake actions and policies to support infrastructure development and achieve objectives aligned with the 2050 net zero emissions target.,,,
What role does joint public-private ownership play in facilitating CO $$_2$$ transport and storage infrastructure in the H21 business model?,"Joint ownership helps manage and deliver CO $$_2$$, remove investment barriers, ensure transparency, fair access, and collaboration with all regions, as well as demonstrate long-term commitment.",,,
How does the H21 business model example address investment barriers and risks in the early phases of market creation for hydrogen-CCS infrastructure deployment?,"The business model addresses barriers and risks through realistic risk sharing, stakeholder engagement, and strategic drivers consistent with the government's emissions target.",,,
What are the key components of the H21 example system business model structure?,"The components include asset and rights ownership, risk allocation, collaboration between public and private sectors, and infrastructure expansion for decarbonization.",,,
How does government underwriting of uninsurable CO $$_2$$ storage risks help in the H21 business model?,Government underwriting helps remove investment barriers for the private sector and assists in structuring storage financial security to facilitate infrastructure expansion.,,,
What are the main elements proposed in the business model for hydrogen storage services in the context described?,,B,TRUE,FALSE
How is private capital sourced in this business model for hydrogen storage services?,,B,TRUE,FALSE
What role does the government play in market development for hydrogen and CO$_2$ in the proposed business model?,,B,TRUE,FALSE
How is hydrogen production supported in this business model and what entity is involved in providing revenue support?,,B,TRUE,FALSE
How is the hydrogen transmission and distribution system priced and regulated in the proposed business model?,,B,TRUE,FALSE
What is the structure proposed for CO$_2$ transport and storage infrastructure remuneration in the business model?,,B,TRUE,FALSE
How are commercial and domestic customers for hydrogen supply serviced in this business model?,,B,TRUE,FALSE
What are the key features of the government-owned initial geological hydrogen storage facilities in this model?,,B,TRUE,FALSE
Can you elaborate on the competitive bid process proposed for public concession in this business model?,,B,TRUE,FALSE
How is the transition of the consumer market to hydrogen facilitated in the proposed business model?,,B,TRUE,FALSE
What are some of the key considerations mentioned for retailers negotiating pricing arrangements with hydrogen producers?,"Retailers negotiating pricing arrangements with hydrogen producers should consider factors such as hydrogen being offered at the same cost as natural gas, EU ETS (or similar UK ETS) pressures, branding and reputational value, and the potential need for capital grants for specific industries.",,,
How is industrial decarbonisation through hydrogen fuel switching proposed to be managed in the given context?,"Industrial decarbonisation through hydrogen fuel switching is suggested to be the responsibility of privately-owned industrial companies, supported by a combination of factors like competitive pricing, branding, reputational value, and potential capital grants.",,,
How is the power generation sector envisioned to be structured under the hydrogen proposal?,"The power generation sector is proposed to operate on a free enterprise business model, with investors being remunerated using a targeted revenue support mechanism based on the existing Contract-for-Difference mechanism alongside the capacity market.",,,
"What role do private investors play in the delivery of infrastructure, facilities, and services in the proposed hydrogen business model?","Private investors are allocated the responsibility of delivering infrastructure, facilities, and services, drawing on established models in the UK and leveraging proven technologies with ongoing support from sponsored projects and expertise in the private sector.",,,
Why is it emphasized that no individual sector or part of a new hydrogen value chain can be facilitated without considering other activities within the chain?,The interdependency of activities within the hydrogen value chain underscores the need to harmonize different mitigation measures and align the risks and responsibilities between public and private stakeholders to ensure the successful deployment of the hydrogen economy as a whole.,,,
What is highlighted as a crucial factor influencing the extent and type of government financial and revenue support in the context of market development?,"The sustainability of market development and, consequently, the required government financial and revenue support heavily depend on government policies and mechanisms for establishing end-use consumer and industrial demand within the hydrogen value chain.",,,
How is the emergence of a full-fledged hydrogen economy portrayed in the discussion?,The emergence of a full-fledged hydrogen economy is depicted as a collaborative effort requiring strong support and strategic design from governments at various levels and industry players to enable large-scale deployment beyond localized production-consumption combinations.,,,
What message is conveyed regarding the commercial viability of end-use technologies in the hydrogen economy?,"The message asserts that commercial technologies for various end-use applications exist, enabling sectors to transition away from fossil fuels once sufficient hydrogen production is available, although there may be efficiency penalties compared to fossil-fired equipment.",,,
In what way does the development of hydrogen end-use technologies face potential hindrances?,"The development of hydrogen end-use technologies may encounter hindrances arising from conflicting technology features needed for different applications, which, in the absence of established markets, could impede further advancement in the sector.",,,
How is the role of hydrogen positioned in future energy systems within the outlined perspective?,"Hydrogen is positioned as a pivotal component of future energy systems, especially with respect to sector coupling, provided it receives integrated support from governments and industry players to complement existing energy vectors and facilitate the transition towards net-zero-CO$_2$ societies.",,,
What are some key applications and expected developments in hydrogen technology mentioned in the article?,"Some key applications and expected developments in hydrogen technology mentioned in the article include the development of gas turbines designed for almost pure hydrogen use, tailor-made efficient hydrogen burners for high temperature processes in industries like steelmaking and glassmaking, further advancements in hydrogen fuel cells for transport and industrial applications, and the role of hydrogen in the transition to a full hydrogen economy with uses in high temperature heat provision, road transportation, energy storage, air and ship transportation, and more.",,,
How is low-carbon hydrogen production discussed in the article?,"Low-carbon hydrogen production is discussed in the article as being hindered by system limitations such as the unavailability of CO2 transport and storage networks for reforming with CO2 capture, and the need for sufficient renewable electricity for water electrolysis. It is highlighted that hydrogen production routes need to be evaluated from a life cycle perspective, and that hydrogen from natural gas with CCS is considered a key enabler for a green hydrogen-based future. The article also mentions the potential for cost reduction in low-carbon hydrogen production through new technology maturing, economies of scale, and learning by doing.",,,
What are some challenges and potential solutions discussed for hydrogen production from biomass?,"Some challenges discussed for hydrogen production from biomass include the complexities of biomass gasification and the low expected availability of biomass for bioenergy due to its potential use in producing other energy vectors or products. The article suggests that technology for hydrogen production from biomass may have a hard time scaling up. However, it also mentions that biohydrogen could play a role in specific small regional contexts despite not being likely to play a significant role in the global transition to net-zero in 2050.",,,
How is the prospect of hydrogen transport and storage networks addressed in the article?,"The article discusses that the implementation of hydrogen transport and storage networks requires careful system design and planning, considering expected local end-uses. It points out that early investment in dedicated hydrogen infrastructure may be unrealistic due to high costs compared to relatively modest offtake. Additionally, addressing the limitations of renewable electricity and CCS networks at scale is crucial for the positive outlook on hydrogen production.",,,
What future advancements are anticipated for hydrogen production technology in the article?,"The article anticipates future advancements in hydrogen production technology, such as improvements in fossil-based hydrogen production at TRL7+, focusing on reforming, H2/CO2 separation, or integration of the two steps. It suggests that by 2050, when GHG neutrality should be reached, these solutions should be ready. The article also discusses the potential for significant cost reduction in low-carbon hydrogen production through new technology maturing, economies of scale, and learning by doing.",,,
How is the role of hydrogen in the transition to a full hydrogen economy described in the article?,"The article describes hydrogen as playing multiple roles in the transition to a full hydrogen economy, including high temperature heat provision, road transportation (especially heavy goods transport), energy storage for balancing the power grid, and potential applications in air and ship transportation. It emphasizes that hydrogen will not have a preferred global winner among its uses, with each country or region likely following different implementation pathways and end-use distribution based on its socio-economic conditions.",,,
What are some key messages regarding hydrogen use and its impact on the transition to CO2 neutrality?,"Some key messages regarding hydrogen use and its impact on the transition to CO2 neutrality include the expectation that hydrogen will take on various roles in the transition, such as in high temperature heat provision, road transportation, and energy storage. The article highlights the importance of large-scale demonstrations of integrated hydrogen end-use systems to address specific issues that H2 conversion technologies may face. It also emphasizes the significance of evaluating hydrogen production routes from a life cycle perspective for a timely transition to a CO2 net-zero society.",,,
How are the costs and feasibility of early investment in dedicated hydrogen infrastructure compared in the article?,"The article discusses that early investment in dedicated hydrogen infrastructure may be deemed unrealistic due to high costs compared to the relatively modest offtake. It suggests that careful system design and planning, considering expected local end-uses, are essential for the implementation of hydrogen transport and storage networks. The article emphasizes the need to address the limitations of renewable electricity and CCS networks at scale for a positive outlook on hydrogen production.",,,
What are the primary factors influencing the prospects for low-carbon hydrogen production discussed in the article?,The primary factors influencing the prospects for low-carbon hydrogen production discussed in the article include system limitations like the unavailability of CO2 transport and storage networks for reforming with CO2 capture and the necessity of sufficient renewable electricity for water electrolysis. The article highlights that low-carbon hydrogen production routes need to be evaluated from a life cycle perspective and mentions the role of hydrogen from natural gas with CCS as a key enabler for a green hydrogen,,,
How can the NG infrastructure kick-start the hydrogen economy without the need for dedicated hydrogen transport networks?,By allowing production to ramp up and enabling bilateral production and use within industrial sites or clusters.,,,
In what ways can the design of hydrogen networks be optimized to accommodate different production and consumption locations?,"By carefully planning for the emergence of production and consumption locations and types, considering factors such as distribution and pressure requirements.",,,
Why is hydrogen storage considered critical for overcoming periods of low production in a hydrogen-based economy?,Hydrogen storage is essential to store excess hydrogen produced from intermittent renewable sources and to ensure a steady supply during periods of low production.,,,
What are some key legal and regulatory requirements for enabling the development of hydrogen infrastructures in Europe?,"Requirements include sound infrastructure regulations, adapted gas market design, integrated energy system planning, efficient permitting procedures, transparent access to the grid, and safe operation of transport networks.",,,
How can business models facilitate the delivery of first-of-a-kind hydrogen infrastructure in Europe?,"By creating models that ensure durable revenues, distribute risks effectively, prioritize societal value in investment decisions, and involve both government and private stakeholders in market development.",,,
Why is the adaptation and development of gas regulatory environments crucial for the growth of hydrogen and CCS value chains in different regions?,"Such adaptation supports timely and effective regulation, encouraging investment in hydrogen infrastructure and markets, ultimately contributing to a net-zero economy.",,,
How can the existing EU regulatory principles integrate small volumes of hydrogen into the natural gas infrastructure?,"By adapting gas market design to allow for higher shares of sustainable gases, sector coupling, and decentralized hydrogen production.",,,
What role do integrated energy system planning and governance tools play in facilitating the development of hydrogen infrastructure?,"They help streamline regulatory processes, ensure efficient permitting procedures, and support transparent access to the grid for hydrogen infrastructure projects.",,,
Why is integrated planning for hydrogen networks important in maximizing network utilization?,"It helps optimize the distribution of production and consumption locations, catering to the varying transmission pressure requirements of different network configurations.",,,
"How can collaborative efforts between private sector stakeholders, regulators, and industry bodies lead to effective regulation of hydrogen value chains, as seen in the UK?","By advancing gas regulatory environments and implementing pragmatic steps, such as hydrogen blending and targeted safety regulations, to support investment and growth of hydrogen markets.",,,
