Question,Answer,,,
What are some key factors influencing the implementation of effective business models for delivering hydrogen and CCS infrastructure in the European Economic Area up to 2030?,"A mix of collaboration and competition between stakeholders, risk allocation and sharing between the public and private sectors, national-level business models in certain countries like The Netherlands and Norway, and public-private business models with support mechanisms in the UK are key factors influencing the implementation of effective business models for delivering hydrogen and CCS infrastructure.",,,
"How does the outlook for system business models supporting wider sectoral and regional growth of hydrogen production, transport, and use compare among different countries in Europe?","The outlook for system business models supporting wider sectoral and regional growth of hydrogen production, transport, and use is more challenging in countries like The Netherlands and Norway, while it is more positive in the UK due to increased government efforts and public-private business models.",,,
What funding sources and organizations have contributed to the ACT ELEGANCY project (Project No 271498)?,"The ACT ELEGANCY project (Project No 271498) has received funding from DETEC (CH), BMWi (DE), RVO (NL), Gassnova (NO), BEIS (UK), Gassco, Equinor, Total, and is co-founded by the European Commission under the Horizon 2020 programme with ACT Grant Agreement No 691712.",,,
"What are some recent references related to hydrogen production, carbon capture and storage (CCS), and decarbonization strategies mentioned in the context?","Some recent references related to hydrogen production, CCS, and decarbonization strategies mentioned in the context include the Global Hydrogen Review 2021 by IEA, studies on joint planning of electricity and hydrogen production, wood gasification with CCS for transport fuel, blue hydrogen feasibility studies, and Europe's largest PEM green hydrogen electrolyser startup by Shell.",,,
How have national-level business models in countries such as The Netherlands and Norway helped in delivering initial hydrogen and CCS projects?,National-level business models in countries like The Netherlands and Norway have helped in delivering initial hydrogen and CCS projects by providing frameworks and support mechanisms for funding and implementation.,,,
"What challenges do countries face in integrating hydrogen production, infrastructure, and markets into a functioning system across regions and market sectors?","Countries face challenges in integrating hydrogen production, infrastructure, and markets into a functioning system across regions and market sectors due to the complexity of coordinating various stakeholders, technological requirements, regulatory frameworks, and investment needs.",,,
How is risk allocated and shared between the public and private sectors in the context of hydrogen and CCS infrastructure projects?,"Risk is allocated and shared between the public and private sectors based on an accurate assessment of which stakeholder is best placed to mitigate and manage the risk, ensuring effective risk management throughout the project lifecycle.",,,
What role does collaboration play in ensuring cost effectiveness of first-of-a-kind projects for government support in the context of hydrogen and CCS infrastructure?,"Collaboration plays a crucial role in ensuring cost effectiveness of first-of-a-kind projects for government support by facilitating knowledge sharing, resource pooling, and efficient coordination among stakeholders to optimize project outcomes.",,,
How do public-private business models contribute to the development of hydrogen and CCS infrastructure and markets in the European Economic Area?,"Public-private business models contribute to the development of hydrogen and CCS infrastructure and markets in the European Economic Area by leveraging both public funding and private sector expertise, resources, and innovation capabilities to accelerate project implementation and market growth.",,,
What are some potential synergies between electricit$ity and hydrogen production highlighted in the context?,"The context highlights potential synergies between electricity and hydrogen production in terms of decarbonization strategies, energy system optimization, and integrated planning to maximize the efficiency and sustainability of both energy sectors.",,,
