Question,Answer
What are the core services provided by KPMG?,"KPMG provides tailored services including Audit and Assurance, Tax Advisory, Management Consulting, and Financial Advisory to assist multinational clients in facing complex business challenges."
How does KPMG in Taiwan stand out in terms of scale and coverage?,"KPMG in Taiwan boasts over 130 practicing accountants and enterprise management consultants, along with more than 2,400 colleagues, operating in Taipei, Hsinchu, Taichung, Tainan, and Kaohsiung, making it one of the largest accounting firms and professional advisory service organizations in the country."
What key elements does KPMG integrate to enhance service quality through its global service network?,"KPMG integrates talent, products, technology, industry knowledge, and best practices to elevate service quality for clients through its global service network."
How does KPMG contribute to its clients' success by partnering closely with them?,"KPMG collaborates closely with clients to help them mitigate risks and seize opportunities, aiding in their success."
How does KPMG's single management structure benefit clients across different office locations in Taiwan?,"With a unified management structure, KPMG in Taiwan can efficiently deploy experienced professionals wherever clients are located, ensuring effective service delivery."
What are some of the key themes discussed in KPMG's Sustainability Consulting chapter?,"KPMG's Sustainability Consulting chapter covers International Net Zero Carbon Emission Developments and Responses, including trends, policy approaches, and progress towards net-zero carbon emissions in Taiwan."
How does KPMG address global net-zero carbon emission challenges in Chapter 2 of its publication?,"KPMG responds to global net-zero carbon emission challenges by discussing science-based targets, ecological transitions, human progress with sustainability, and various projects contributing to reducing carbon emissions."
"What role does KPMG play in promoting standards, testing, and certification for electrical energy storage and electric vehicles in Taiwan?","KPMG in Taiwan actively participates in promoting the standards, testing, and certification of electrical energy storage and electric vehicles in partnership with relevant government bodies."
How does KPMG in Taiwan support the country's transformation towards net-zero carbon emissions by 2050?,"KPMG in Taiwan supports Taiwan's transition towards net-zero carbon emissions by advocating for clear policies, promoting sustainable practices, and assisting in the implementation of strategic initiatives."
How does KPMG align with the industry's focus on net-zero emissions in its services and collaborations with clients?,"KPMG aligns with industry trends by emphasizing net-zero emissions in its service offerings, collaboration projects, and support for clients' sustainability goals."
How is TCI reaffirming its sustainable investments to help customers achieve net-zero pathways in 63 countries?,TCI is reaffirming its sustainable investments to help customers achieve net-zero pathways in 63 countries by pledging to achieve zero-carbon factories and zero-carbon products.
What are some examples of sustainable investments and developments in hydrogen energy applications in Europe?,"Some examples of sustainable investments and developments in hydrogen energy applications in Europe include Air Liquide and TotalEnergies partnering to develop low-carbon hydrogen production in the Normandy Industrial Basin, and Bosch offering technology for hydrogen production and fuel cells."
How is Germany planning to become climate-neutral by 2045?,Germany is planning to become climate-neutral by 2045 according to the German Institute in Taipei.
What are some strategic approaches to achieve net-zero transition in Taiwan according to CPC Corporation?,"According to CPC Corporation, some strategic approaches to achieve net-zero transition in Taiwan include pathways to net zero, main strategies and action plans, and carbon capture, utilization, and storage (CCUS)."
How is the Renewable Consulting Group advising on Taiwan's CPC net-zero development strategy based on European oil and gas industrial experience?,The Renewable Consulting Group is advising on Taiwan's CPC net-zero development strategy by drawing on European oil and gas industrial experience.
What role does ?rsted play in achieving net-zero and energy independence with offshore wind and renewable hydrogen?,?rsted plays a role in achieving net-zero and energy independence with offshore wind and renewable hydrogen by providing a feasible strategy for developing renewable hydrogen.
How is the Low Carbon Initiative (LCI) in Taiwan contributing to realizing a low carbon future?,"The Low Carbon Initiative (LCI) in Taiwan is contributing to realizing a low carbon future by championing multiple technologies, solutions, and practices developed by its members to reach net zero by 2050."
How are European corporations leading in R&D and the development of low carbon energy solutions and technologies?,"European corporations are leading in R&D and the development of low carbon energy solutions and technologies by creating new supply chains and business models, as pioneers and leaders in low carbon development."
What are some examples of best practices and examples in Taiwan and globally for reaching net zero emissions by 2050?,"Some examples include Air Liquide and TotalEnergies partnering to decarbonize hydrogen production, Bosch offering technology for hydrogen production, K&L Gates sharing hydrogen policy and development strategy of Australia, and more."
How are members of ECCT actively helping Taiwan to reach its net-zero goals across all industry sectors?,"Members of ECCT are actively helping Taiwan to reach its net-zero goals across all industry sectors by cooperating with CPC Corporation to publish reports, showcasing best practices and examples, and supporting Taiwan's commitment to net-zero by 2050."
How is Atlas Copco contributing to reducing greenhouse gas emissions in its entire value chain?,"Atlas Copco is committing to science-based targets for the reduction of greenhouse gas emissions, showing a commitment to sustainability."
What role is Tonglit Logistics playing in the creation of a smart green carbon neutral logistics park?,"Tonglit Logistics is part of an ambitious project to create a smart green carbon neutral logistics park, demonstrating a focus on sustainable practices."
How is Standard Chartered supporting the transition to net zero?,"Standard Chartered is providing finance to support initiatives aimed at reaching net zero, highlighting the importance of financial backing in sustainability efforts."
What services do the Renewables Consulting Group and T?V Rheinland offer to help clients transition to net zero?,"The Renewables Consulting Group and T?V Rheinland provide valuable consulting and verification services to assist clients in transitioning to net zero, showcasing expertise in sustainability practices."
How are the German Institute Taipei and French Office in Taipei contributing to reaching net zero targets in Taiwan?,"The German Institute Taipei and French Office in Taipei are contributing national policies and strategies to aid in reaching net zero targets, showing international cooperation in sustainability goals."
What strategies is CPC implementing to reduce carbon emissions and achieve net zero by 2050?,"CPC is focusing on high-value petrochemicals, low-carbon emissions, and lean-renewable energy strategies to reduce carbon emissions and work towards net zero by 2050."
How is CPC incorporating hydrogen energy into its future plans for sustainability?,"CPC is adopting hydrogen energy for future sustainability plans, showcasing a commitment to exploring clean energy alternatives."
What technologies is CPC utilizing for carbon capture and utilization to reduce emissions?,"CPC is implementing carbon capture, utilization, and storage (CCUS) technologies and developing crucial catalysts for carbon capture and utilization to reduce emissions, demonstrating innovation in sustainability practices."
How is CPC integrating renewable energy into its operations to work towards net zero?,CPC is developing geothermal generation and evaluating plans for the Hydrogen Energy Supply Chain Project (HESC) to integrate renewable energy sources and progress towards net zero emissions.
"Why does Lee Shun-Chin, Chairman of CPC Corporation, Taiwan, believe in the importance of transitioning to sustainable practices?",Lee Shun-Chin believes that the transition to sustainable practices is crucial for the company's survival and envisions CPC as a Clean Power Company driving sustainable development in Taiwan.
"What are some key strategies outlined in ""Taiwan's Pathway to Net-Zero Emissions in 2050""?","Some key strategies outlined in ""Taiwan's Pathway to Net-Zero Emissions in 2050"" include wind power, solar photovoltaic, hydrogen power, innovative energy, power systems and energy storage, energy conservation, and carbon capture, utilization and storage."
How does the European Green Deal aim to transform the European Union by 2050?,"The European Green Deal aims to transform the European Union into a modern, resource-efficient, and competitive climate-neutral economy by 2050."
Why is Taiwan considered vulnerable to the effects of climate change?,"Taiwan is considered vulnerable to the effects of climate change because as an island, it is especially vulnerable to severe storms and floods that are becoming more intense with climate change."
How has the EU been at the forefront of the global fight against climate change according to the provided information?,"The EU has been at the forefront of the global fight against climate change by investing in realistic technological solutions, empowering citizens, and aligning action in key areas such as industrial policy, finance, and research while ensuring social fairness."
What role does hydrogen energy play in global technological concerns and national strategies according to the IEA Net Zero report?,"According to the IEA Net Zero report, hydrogen energy occupies a significant role in global technological concerns and national strategies, emerging as a sought-after technology option for all sectors."
How can companies take part in the systemic industry transformation towards net-zero initiatives?,"Companies can take part in the systemic industry transformation towards net-zero initiatives by understanding the importance of net-zero to their organizations, planning net-zero trends holistically and meticulously, and adopting renewable energy and low-carbon technologies."
What are some of the sectors that will play a role in achieving climate neutrality according to the European Commission?,"According to the European Commission, all sectors of society and the economy, including the power sector, industry, mobility, buildings, agriculture, and forestry, will play a role in achieving climate neutrality."
How can Taiwan and the EU collaborate in developing low carbon technologies towards the goal of net zero emissions?,Taiwan and the EU can collaborate in developing low carbon technologies by sharing European low-carbon best practices and solutions across a wide range of industries and sectors to help Taiwan reduce its carbon emissions.
"What is the significance of the report ""CPC ??ECCT 2022 Net Zero Report"" in the context of global climate action?","The report ""CPCECCT 2022 Net Zero Report"" symbolizes common efforts in advocating for a greener world and showcasing European low-carbon best practices and solutions to help partners reduce carbon emissions."
How can achieving net zero emissions by 2050 contribute to securing a healthy planet for future generations and improving well-being today?,"Achieving net zero emissions by 2050 can contribute to securing a healthy planet for future generations and improving well-being today by overcoming climate challenges, transforming into resource-efficient economies, and building a better future for all."
What are some challenges in the application of hydrogen energy mentioned in the text?,"Some challenges mentioned in the text include the need for energy conversion for hydrogen generation and storage, transportation and storage challenges due to the nature of hydrogen, and overcoming bottlenecks in availability, transportation, storage, and energy costs."
"According to the Paris Agreement, what are the global greenhouse gas emissions reduction targets by 2030 and 2050?",The Paris Agreement specifies that global greenhouse gas emissions must be reduced by 45% by 2030 and reach net zero emissions by 2050.
What is the definition of Net Zero Emissions (Net Zero Emissions) mentioned in the text?,"Net Zero Emissions is defined in the text as being achieved when human-induced CO$_2$ emissions are balanced in the atmosphere through human-induced CO$_2$ removal over a specified period of time, also known as Carbon Neutrality."
"In terms of greenhouse gas reduction scope, what does Net zero CO$_2$ emissions refer to?","Net zero CO$_2$ emissions refer to achieving a balance where human-induced CO$_2$ emissions are removed from the atmosphere over a specified period, according to the IPCC."
How does the development of hydrogen energy contribute to the goals of net-zero carbon emissions by 2050?,"The development of hydrogen energy is crucial for achieving net-zero carbon emissions by 2050 as a clean energy source that can replace traditional fossil fuels, contributing to reducing greenhouse gas emissions."
What are some of the forward-looking technologies mentioned in the text that governments and companies are encouraged to invest in for achieving net-zero emissions?,"Some forward-looking technologies mentioned in the text include hydrogen energy, carbon sequestration, carbon capture, utilization and storage (CCUS), hydrogen-fueled vehicles, and floating wind turbines."
How does the text highlight the importance of cross-border and cross-domain partnerships in moving towards a net-zero carbon emission future?,The text emphasizes the importance of governments and companies working together in creating cross-border and cross-domain partnerships to accelerate the transition towards a net-zero carbon emission future.
What milestones were set by the Kyoto Protocol for greenhouse gas reduction?,"The Kyoto Protocol set milestones for greenhouse gas reduction, with the aim of controlling global warming to within 2 degrees Celsius and striving for a carbon reduction plan within 1.5 degrees Celsius of the pre-industrial average."
How does the Paris Agreement aim to address global warming with regards to carbon reduction targets?,"The Paris Agreement aims to address global warming by setting targets for global greenhouse gas emissions reduction, including the goal of reaching net zero emissions by 2050."
What are some of the initiatives proposed by the global financial industry in response to policy and emerging market opportunities mentioned in the text?,"Some initiatives proposed by the global financial industry mentioned in the text include net-zero transformation financial initiatives, particularly in areas such as hydrogen energy, battery storage, smart grid, and energy-saving technologies, attracting multi-billion dollar capital investments."
What are the 7 significant categories of greenhouse gases that are included in net zero emissions goals?,"The 7 significant categories of greenhouse gases are carbon dioxide (CO$   2$), nitrous oxide (N$   2$O), methane (CH$   4$), hydrofluorocarbons (HFCs), perfluorocarbons (PFCs), sulfur hexafluoride (SF$   6$), and nitrogen trifluoride (NF$   3$)."
How did the Green Swan Report highlight the connection between climate shocks and systemic financial risk?,The Green Swan Report pointed out that climate shocks will create subsequent systemic financial risk due to rising global temperatures and the occurrence of extreme climate events.
What is the significance of the Paris Agreement Handbook in relation to international carbon trading?,"The Paris Agreement Handbook adopted Article 6 of the Paris Agreement, which lays the foundation for future international carbon trading by resolving issues such as double-counting and the use of Certified Emission Reductions (CERs) certified after 2013."
"Why is the Phasing out of ""coal-fired power generation without carbon capture"" significant in the Glasgow Climate Convention?","The phasing out of ""coal-fired power generation without carbon capture"" is significant in the Glasgow Climate Convention as it aims to reduce greenhouse gas emissions and transition towards cleaner energy sources."
What commitments were made by 105 countries in the Global Methane Pledge?,105 countries pledged to reduce current methane emissions by 30% by 2030 as part of the Global Methane Pledge.
What does the U.S.-China Glasgow Joint Declaration focus on in terms of climate action?,"The U.S.-China Glasgow Joint Declaration focuses on establishing environmental standards for managing greenhouse gases, promoting clean energy transformation, industrial decarbonization, and exchanging emission reduction plans."
"How many financial institutions are represented by the Glasgow Financial Alliance for Net Zero, and what is their combined asset value?","The Glasgow Financial Alliance for Net Zero represents 450 financial institutions with $130 trillion in assets, aiming to transition towards global net zero emissions."
What are the key points of the Glasgow Leaders' Declaration on Forest and Land Use?,The Glasgow Leaders' Declaration aims to end deforestation and land loss by 2030 and raise £14 billion ($5.2 trillion) in public and private funding to address these issues.
What were some of the resolutions reached at the COP26 Meeting in November 2021?,"Resolutions at the COP26 Meeting included the adoption of Article 6 of the Paris Agreement, the signing of the Glasgow Climate Convention, and commitments towards international carbon trading and clean energy transition."
What is the purpose of the Global Coal to Clean Power Transition Statement signed by 46 countries?,"The statement aims to transition from coal-fired power generation to clean energy sources, stop the construction of new coal-fired power plants, and ensure a just transition in countries signed the agreement."
What are the key sectors prioritized in the Glasgow Breakthrough Agenda at COP26?,"The key sectors prioritized in the Glasgow Breakthrough Agenda at COP26 are steel, road transport, agriculture, hydrogen, and electricity."
Which countries have committed to selling all new zero-carbon vehicles in major markets by 2035?,"Eleven car manufacturers including Ford, General Motors, Jaguar Land Rover, Mercedes-Benz, and Volvo have committed to selling all new zero-carbon vehicles in major markets by 2035."
What is the UK's target reduction in carbon emissions by 2030 compared to 1990?,The UK aims for a 68% reduction in carbon emissions by 2030 compared to 1990.
When does China aim to achieve carbon neutrality?,China plans to achieve carbon neutrality by 2060.
Which country has legislated net zero emissions as of June 2022?,The United Kingdom is one of the countries that has legislated net zero emissions as of June 2022.
What is the reduction target for the US in carbon emissions by 2050 compared to 2005?,"The US aims for net zero carbon emissions by 2050, with a reduction target of 50% to 52% in 2030 compared to 2005."
How many countries have committed to net zero emissions as of June 2022?,"As of June 2022, 129 out of the world's 198 countries have committed to net zero emissions."
What is the reduction target for India in carbon intensity by 2030?,India aims for a 45% reduction in carbon intensity by 2030.
What is the reduction target for Japan in carbon emissions by 2030 compared to 2013?,Japan aims for a 46% reduction in carbon emissions by 2030 compared to 2013.
How many countries have legislated net zero emissions as of June 2022?,"21 countries, including the UK, EU, Canada, Japan, and Korea, have legislated net zero emissions as of June 2022."
How does the UK aim to contribute to reducing greenhouse gas emissions by 2030 and achieve net zero by 2050?,"The UK plans to reduce greenhouse gas emissions by 68% by 2030 and reach net zero by 2050 through the Prime Minister's announcement of a 10-point plan under the Green Industrial Revolution, focusing on renewable energy, financial development, carbon sequestration technologies, and strengthened efforts to reduce emissions."
"What is the European Union's goal regarding climate neutrality, and what policies have they put in place to achieve it?","The European Union aims to become the world's first climate-neutral continent by 2050. They have launched the European Green Deal with a roadmap of 50 policies to be implemented over three years, including reducing greenhouse gas emissions by 55% by 2030, implementing the ""Fit for 55 package"" with 12 policy measures, and setting up the EU Emissions Trading System and the Carbon Border Adjustment Mechanism."
How has the US climate change approach evolved from the Obama administration to the Biden administration?,"The US climate efforts transitioned from the Climate Action Plan during Obama's term to the America First Energy Plan under Trump, and then to a renewed commitment under Biden with a 50-52% reduction in greenhouse gas emissions by 2030 and a net-zero goal by 2050. Biden's administration has introduced significant policies like the $1 trillion Infrastructure Investment and Jobs Act to drive decarbonization and promote renewable energy industries."
What is the significance of the US Build Back Better Act in terms of combating climate change?,"The US Build Back Better Act includes provisions to reduce the cost of clean energy for middle-class households, promote clean energy technologies, decarbonize the manufacturing sector, create green jobs, and ensure environmental justice. It allocates 40% of the proceeds to benefit disadvantaged communities and invest in natural solutions like coastal restoration and forest management."
"What transformation strategies and governance foundations are outlined in Taiwan's ""Taiwan 2050 Net-Zero Emissions Roadmap""?","Taiwan's roadmap includes four transformation strategies (energy, industry, life, and social transformation) and two governance foundations (technology R&D and climate governance) to achieve net zero emissions by 2050. It aims to lead Taiwan's transformation through legal enhancements, carbon pricing policies, and green financial initiatives."
"How did Taiwan's ""Greenhouse Gas Reduction and Management Act"" evolve to the ""Climate Change Response Act"" regarding the national long-term reduction target to 2050 net-zero greenhouse gas emissions?","The ""Greenhouse Gas Reduction and Management Act"" was amended in 2022 to ""Climate Change Response Act,"" explicitly amending the national long-term reduction target to 2050 net-zero greenhouse gas emissions."
Why is it crucial for enterprises to complete greenhouse gas inventories and data verification as per the recent policies?,"Without accurate greenhouse gas emissions data, setting an effective reduction target would be challenging. Completing inventories and verification helps in establishing targets and monitoring progress effectively."
How does the announcement of the Carbon Boundary Adjustment Mechanism (CBAM) impact the importance of carbon pricing internationally?,"The announcement of CBAM in the EU has accelerated the importance of carbon pricing globally, making it an indispensable policy tool for greenhouse gas emission reduction."
What are the two key directions in the planning of the carbon pricing system mentioned in the policies?,"The two directions are: 1) Carbon fees with staged promotion and fund allocation for reduction technologies, and 2) Establishment of a carbon trading system to encourage reduction credits and future international cooperation."
How does the Ministry of Economic Affairs aim to achieve net-zero energy transformation in Taiwan?,"The MOEA aims to promote renewable energy, increase gas-fired power generation, reduce coal-fired power use, develop carbon-free energy systems, and invest in hydrogen and carbon capture technologies."
What strategies does the Ministry of Economic Affairs have for industrial transformation towards net-zero goals?,"The MOEA plans to promote industrial carbon reduction through equipment replacement, low-carbon fuel conversion, and intelligent energy-saving management for a vision of industrial circular economy and adoption of carbon-free fuels."
What support mechanisms is the Ministry of Economic Affairs planning to develop to promote socially equitable transformation in the net-zero process?,"The Ministry of Economic Affairs plans to develop assistance and protection mechanisms for affected parties, analyze affected stakeholders in advance, communicate possible misunderstandings, and build awareness."
How does the Energy Administration Act aim to improve energy demand management and green energy development environment?,"The Energy Administration Act aims to mandate the energy supply industry to disclose energy sales statistics, raise penalties, and publish violators' names to encourage compliance with energy-saving regulations."
What are the critical points of the Renewable Energy Development Act in terms of enhancing renewable energy capacity?,"The Renewable Energy Development Act aims to reduce space limitations of installations, increase flexibility of utilization, speed up administrative operations, and expand installations of renewable energy."
