Question,Answer
How does the Electricity Act propose to enhance energy storage facilities and incentivize renewable energy construction?,"The Electricity Act aims to clarify the positioning of energy storage facilities, construct business models like capacity markets, enhance incentives for energy storage, and refine application procedures for renewable energy generation."
What dedicated law will be enacted to promote the development of hydrogen energy fuels in the net-zero transformation process?,A dedicated hydrogen energy management law will be enacted to promote the development of hydrogen energy fuels.
How does the Taiwan 2050 Net Zero Emission Policy propose to address industry-specific challenges in the net-zero transformation?,"The Taiwan 2050 Net Zero Emission Policy proposes multiple communication sessions for different industries, developing industry-specific guidelines to accelerate net-zero transformation."
How does the growth of renewable energy pose challenges to the stability of electricity supply in the net-zero transformation?,"The growth of renewable energy poses challenges due to its intermittent nature, requiring clear assessment of energy storage technologies to maintain stability in power supply."
Why is fair transformation considered a key aspect in promoting net-zero transformation across various sectors?,"Fair transformation is considered key to ensure social equality and just transition in net-zero transformation encompassing technology, society, economy, and politics."
What governance principles are highlighted in the Zero Emission Pathway blueprint to promote a fair transition in the net-zero process?,"The Zero Emission Pathway blueprint emphasizes governance principles of ""balance of policy objectives,"" ""fairness of social distribution,"" and ""inclusiveness of interests"" to promote a fair transition."
How can disadvantaged groups be ensured participation in policy formulation to achieve a fair and just zero-carbon transformation?,"Participation of disadvantaged groups in policy formulation ensures their voices are heard, reduces conflicts, and aids in achieving a fair and just zero-carbon transformation."
"What is the significance of Taiwan's policy and progress in promoting the standards, testing, and certification of electrical energy storage and electric vehicles for the implementation of low-carbon energy and vehicle electrification?","By harmonizing international standards bodies and establishing national standards, testing capabilities, and certification schemes, Taiwan ensures the safety, fairness, and international equivalence of its zero-emission process. This promotes the integration of renewable energy, strengthens the power grid, and enhances the safety of electrical energy storage systems and electric vehicles."
What national standards have been developed for grid-integrated electrical energy storage systems in Taiwan?,"National standards such as CNS 62619, CNS 63056, and the upcoming CNS 62933-5-2 have been established to address safety requirements for secondary single cells, battery packs, and grid-connected energy storage systems, based on harmonization with relevant IEC standards."
How many testing laboratories accredited by the Taiwan Accreditation Foundation are available for components testing of cell and battery systems in Taiwan?,There are more than 6 testing laboratories accredited by the Taiwan Accreditation Foundation for components testing of cell and battery systems in Taiwan.
What is the testing capacity of the new large scale electrical energy storage battery testing laboratory being built in the Hsinchu Science Park ??Tongluo campus?,"The new laboratory will have a testing capacity of 360 kW/360 kWh with special fire controls, explosion-proof features, and pollution prevention capabilities. It is expected to provide MW-level power conditioning system (PCS) services starting October 2024."
How does Taiwan ensure the installation and operation safety of energy storage systems through certification schemes?,Taiwan introduces a project certification management framework and develops relevant inspection technical specifications and certification systems aligned with national and international standards. The voluntary product certification (VPC) system for components like single cells and battery systems has been implemented and expanded to improve safety.
What is the significance of promoting the testing and certification of electric vehicle battery-related standards in Taiwan's net-zero pathway?,"Ensuring the safety and reliability of electric vehicle rechargeable energy storage systems is crucial for reducing carbon emissions through vehicle electrification. By harmonizing standards and offering testing services, Taiwan supports the adoption of electric vehicles as part of its sustainable energy strategy."
How does the national standard CNS 16160 contribute to the testing and certification of electric vehicle rechargeable energy storage systems in Taiwan?,"CNS 16160 specifies requirements for electrical safety and rechargeable energy storage systems for electric road vehicles. By aligning with UN/ECE Regulation No. 100, this standard ensures comprehensive testing and certification of electric vehicle energy storage in Taiwan."
When was the national standard CNS 16160 for electric vehicle rechargeable energy storage systems announced in Taiwan?,"CNS 16160 was announced on December 24, 2021, as part of Taiwan's efforts to set specific requirements for the safety and performance of electric road vehicle energy storage systems."
What new service will the large-scale battery safety testing laboratory in Taiwan offer for electric vehicles starting January 2025?,"The laboratory is expected to provide full-size lithium battery pack testing services for electric vehicles starting January 2025, ensuring the safety and performance of electric vehicle rechargeable energy storage systems."
How does the promotion of testing and certification of electric vehicles' battery-related standards align with Taiwan's goals of net-zero emissions and vehicle electrification?,"By establishing standards, increasing testing capabilities, and implementing certification schemes, Taiwan enhances the safety, reliability, and environmental impact of electric vehicles, supporting the transition to low-carbon transportation and helping achieve its net-zero emissions targets."
What are the main safety requirements included in the national standards for electric vehicle charging systems according to CNS 15511-1 and CNS 15511-23?,The main safety requirements include general requirements and requirements for electric vehicle DC charging stations.
How many laboratories accredited by the TAF are available for testing capacity in this context?,There are more than 3 laboratories accredited by the TAF.
Which communication requirement is outlined in the national standards for electric vehicle charging systems according to CNS 15511-24?,The communication requirement is for digital communication between EV DC charging stations and EV charging control.
What is the voluntary product certification (VPC) system for electrical energy storage systems and power supply equipment for electrical energy storage and electric vehicles expected to be fully announced and implemented by?,The VPC system is expected to be fully announced and implemented by November 2022.
"Which charging interfaces used in Europe, the United States, and Japan are included in the national standards to cater to different vehicle brands?","Charging interfaces used in Europe, the United States, and Japan are included in the national standards."
When is the new construction of the safety testing laboratory of battery electrical energy storage at the Hsinchu Science and Technology Park - Tongluo campus expected to provide testing services?,Testing service is scheduled to be available in January 2025.
"How many countries, along with Taiwan and the European Union, have declared their net zero emission targets as of June 13, 2022?",132 countries have declared their net zero emission targets.
What convention ratified by the United Nations in 1992 sparked global attention to carbon reduction?,"The ""United Nations Framework Convention on Climate Change"" ratified in 1992 sparked global attention to carbon reduction."
How does the UK regard the net-zero transformation in terms of economic growth?,"The UK considers the net-zero transformation as a ""green industrial revolution."""
"What milestone did Japan set with its ""2050 carbon neutral growth strategy"" in response to the global trend of carbon reduction?",Japan set the milestone of achieving carbon neutrality by 2050 with its strategy.
What are the two foundational environments mentioned for technology research and development and climate laws in Taiwan's transition towards net zero emissions by 2050?,The two foundational environments are technology research and development and climate laws. These are essential for establishing the framework needed to drive Taiwan's transition to a net zero emissions sustainable society by 2050.
How does Taiwan plan to achieve a net-zero transition in the energy industry according to the EPA's 2021 National Greenhouse Gas Emissions Inventory Report?,"Taiwan intends to adopt a 2x2 net zero transition framework focusing on ""low-carbon-zero carbon"" and ""energy-industry"" initiatives. This approach involves prioritizing renewable energy sources like solar and wind power, alongside reducing coal combustion and encouraging the development of forward-looking energy technologies like geothermal, biomass, and ocean energy."
What is the significance of hydrogen energy in Taiwan's 2050 Net Zero Roadmap?,Hydrogen energy plays a crucial role in Taiwan's 2050 Net Zero Roadmap by not only providing carbon-free electricity but also aiding in reducing carbon emissions by replacing fossil fuels in various industries. It is a key technology highlighted for achieving sustainability and transitioning towards a net zero emissions society by 2050.
How does Taiwan plan to address the development of hydrogen energy supply sources in the short term?,"In the short term, Taiwan aims to produce hydrogen from natural gas through steam reforming, utilize industrial hydrogen by-products, and assess the feasibility of importing hydrogen from other countries to meet the current demand. This strategy will help bridge the gap until more sustainable hydrogen production methods can be implemented."
What are some of the development goals outlined for hydrogen energy application technology in Taiwan?,"Development goals include all-hydrogen/hybrid power generation, integrating hydrogen into steel production processes, and exploring hydrogen blending technology in existing gas-fired or coal-fired power generation units. These initiatives aim to reduce carbon emissions and promote the adoption of hydrogen in various industrial processes."
How does Taiwan plan to expand the production of hydrogen from renewable energy sources in the long term?,Taiwan aims to accelerate the installation of renewable energy sources within its borders to increase the production of hydrogen from sustainable sources gradually. This long-term strategy aligns with the goal of transitioning towards a net zero emissions society by reducing reliance on traditional fossil fuels for hydrogen production.
What are some examples of forward-looking energy technologies Taiwan plans to foster for achieving net zero emissions by 2050?,"Taiwan intends to promote technologies such as geothermal, biomass, and ocean energy with localized advantages to strengthen its renewable energy portfolio. These technologies play a vital role in the country's transition towards a sustainable and carbon-free energy environment."
How does Taiwan aim to improve energy efficiency in the industrial sector to support the net-zero transition?,"Taiwan plans to implement strategies like ""leading small industries with large ones,"" which prioritize energy efficiency improvements in different industries. By promoting approaches like ""carbon reduction through counseling"" and encouraging industrial transitions towards sustainable energy practices, Taiwan aims to drive overall energy efficiency enhancements and advance towards net zero emissions."
What role does the Ministry of Economic Affairs (MOEA) play in promoting hydrogen energy in Taiwan?,"The MOEA has established the ""Hydrogen Energy Promotion Team"" to address short-, medium-, and long-term challenges related to hydrogen energy supply, application, and transmission. It fosters collaboration with major hydrogen-producing countries to discuss strategies for integrating hydrogen technologies and promoting their use across various sectors to support Taiwan's transition toward a sustainable energy future."
How do leading countries like Germany and Japan influence Taiwan's approach to hydrogen energy development for achieving net zero emissions?,"Leading countries like Germany and Japan influence Taiwan's strategy by showcasing innovative methods of utilizing hydrogen energy, such as producing green hydrogen for mobile vehicles and incorporating hydrogen in industrial processes. Examples like off-shore wind power utilization and hydrogen importation highlight potential pathways for Taiwan to adopt similar technologies and accelerate its transition towards net zero emissions."
How does CPC utilize existing natural gas facilities to assess the location of hydrogen import and transition storage facilities in the short term?,CPC utilizes existing natural gas facilities to assess the location of hydrogen import and transition storage facilities in the short term by repurposing certain infrastructure and evaluating their compatibility with hydrogen storage and transport requirements.
What is the focus of promoting energy efficiency in the industrial and manufacturing sectors according to the IEA's 2050 Global Energy Sector Net Zero Emissions Roadmap report?,"The focus is on mandatory regulations and incentive mechanisms to improve energy efficiency in the industrial and manufacturing sectors, aiming to achieve the fastest and most cost-effective measure for net zero emissions."
How does the energy auditing system established annually contribute to energy efficiency in large energy users?,"The energy auditing system established annually sets energy saving targets and implementation plans for large energy users, leading to an average annual energy saving rate increase of 0.79 times compared to the period before its implementation."
What industries in Taiwan were subject to energy efficiency regulations from 2012 to 2016?,"The six major industries subject to energy efficiency regulations in Taiwan from 2012 to 2016 were petrochemical, electronics, steel, cement, textile, and paper industries."
How do subsidies for energy saving improvement contribute to the competitiveness of enterprises?,"Subsidies for energy saving improvement help increase competitiveness by promoting the replacement of old equipment with high-energy-efficient alternatives such as air compressors, fans, and pumps, thereby improving production efficiency and equipment energy efficiency."
How can the effectiveness of energy saving be increased for large users according to the mentioned mechanisms?,Large users can increase the effectiveness of energy saving by implementing mechanisms such as professional technologies in the energy technology service industry and focusing on the accelerated replacement of old equipment with high-energy-efficient alternatives.
What role do energy efficiency regulations play in the management of major industrial sectors in Taiwan?,Energy efficiency regulations play a vital role in strengthening efficiency management for major industrial sectors by setting standards related to unit product energy consumption or the efficiency of major energy-consuming equipment.
How do regulations regarding energy users setting energy saving targets contribute to the annual energy saving effect?,Regulations requiring energy users to set energy saving targets contribute to the 1% annual energy saving effect by establishing energy auditing systems and implementing plans to enhance energy efficiency within the industrial sectors.
What measures are considered as a priority for promoting energy efficiency in the industrial and manufacturing sectors?,"Mandatory regulations and incentive mechanisms are considered a priority for promoting energy efficiency in the industrial and manufacturing sectors, in line with the goal of achieving net zero emissions."
How does the promotion of energy efficiency align with Taiwan's industrial energy consumption in comparison to other sectors?,"The promotion of energy efficiency is crucial for Taiwan's industrial sector, which exhibits significantly higher energy consumption compared to other sectors, making it a priority area for energy efficiency measures and regulations."
